occupationUri,occupationLabel,skillLabel,relationType,skillType,skillUri,iscoGroup,mapped_skills
http://data.europa.eu/esco/occupation/8d9ec84d-cf2d-4179-87bc-335cda54a427,database designer,"information structure, systems development life-cycle, database, web programming, ICT security legislation, business process modelling, resource description framework query language, query languages, database development tools, database management systems, systems theory, migrate existing data, use markup languages, develop automated migration methods, assess ICT knowledge, manage database, perform data analysis, create software design, write database documentation, design database scheme, operate relational database management system, create database diagrams, create data sets, analyse business requirements, manage standards for data exchange, apply ICT systems theory, define technical requirements, Haskell, Erlang, SAS language, Agile project management, Ruby (computer programming), Common Lisp, Lisp, Visual Basic, Java (computer programming), MDX, computer programming, Prolog (computer programming), OpenEdge Advanced Business Language, JavaScript, DB2, Microsoft Access, XQuery, Perl, Smalltalk (computer programming), PHP, OpenEdge Database, Assembly (computer programming), data engineering, ObjectStore, C#, MySQL, TripleStore, R, Groovy, ASP.NET, APL, SPARQL, Oracle WebLogic, Microsoft Visual C++, IBM Informix, TypeScript, CoffeeScript, Objective-C, ML (computer programming), LDAP, PostgreSQL, AJAX, C++, Filemaker (database management systems), SAP R3, Swift (computer programming), ICT project management methodologies, SQL Server, MATLAB, unstructured data, CA Datacom/DB, LINQ, Python (computer programming), Scratch (computer programming), Process-based management, Teradata Database, lean project management, VBScript, Oracle Relational Database, COBOL, MarkLogic, Pascal (computer programming), ABAP, data science, N1QL, data models, Scala, define database physical structure, use databases, use access control software, design database in the cloud, design database backup specifications, apply technical communication skills, manage cloud data and storage, build business relationships, perform resource planning","essential, optional","knowledge, skill/competence","http://data.europa.eu/esco/skill/03ff0d53-573a-47a0-a0ad-1995815a4339, http://data.europa.eu/esco/skill/09f2f811-a3fb-4de3-a70f-6420a6935575, http://data.europa.eu/esco/skill/43ae58b9-5e56-4524-b45a-b422777a0576, http://data.europa.eu/esco/skill/69bbd53f-fbb0-4476-b4b2-ef7844464e28, http://data.europa.eu/esco/skill/7814e88f-c133-4c3b-b27f-857afa145d42, http://data.europa.eu/esco/skill/98301d4a-2cc3-439d-8d7f-0b6ac76302bb, http://data.europa.eu/esco/skill/99207709-d076-4cce-ba38-e90d3bb28806, http://data.europa.eu/esco/skill/9cf681c7-89ec-470c-b651-7fe03786f586, http://data.europa.eu/esco/skill/9ef0f3a0-9ce2-4ef1-a987-0366b5cb2dbe, http://data.europa.eu/esco/skill/ab1e97ed-2319-4293-a8b7-072d2648822f, http://data.europa.eu/esco/skill/cdd8b6b2-2fd9-453c-8d62-8a1dc6efcd49, http://data.europa.eu/esco/skill/020918ef-4b55-47c1-8430-ab7b8f6a7377, http://data.europa.eu/esco/skill/0af062de-eb43-41e9-9b96-249e2cd22d26, http://data.europa.eu/esco/skill/0b0335f3-0aa1-491e-895e-81fc8774a300, http://data.europa.eu/esco/skill/0dc7aa1b-b5af-4f4b-81ce-ee22ed8b6926, http://data.europa.eu/esco/skill/29fb0fb5-dfc4-4098-ac9b-3a712000f48f, http://data.europa.eu/esco/skill/2b92a5b2-6758-4ee3-9fb4-b6387a55cc8f, http://data.europa.eu/esco/skill/3bddfd7c-ab6d-40c2-883d-5e97fb7640ba, http://data.europa.eu/esco/skill/64db87c7-2360-4e20-88d3-d222402e477c, http://data.europa.eu/esco/skill/6c08403c-a5bb-4868-b8c2-b7d039c0e511, http://data.europa.eu/esco/skill/7369f779-4b71-4aab-8836-48b69c676eec, http://data.europa.eu/esco/skill/84f58e3d-8669-4d83-8c1d-5dd1e73a654f, http://data.europa.eu/esco/skill/906323f4-00c4-4c3b-ab5a-8af77be3456e, http://data.europa.eu/esco/skill/b04f377b-ee80-4b38-aca1-19d266a23b17, http://data.europa.eu/esco/skill/cb5cccc9-abe4-4b11-abe6-d27e5cd85fb1, http://data.europa.eu/esco/skill/cbe2c304-1e7d-489a-97d9-a7d3e37a9db6, http://data.europa.eu/esco/skill/d9e5349e-8791-49c2-8ba4-839fdd1606c2, http://data.europa.eu/esco/skill/000f1d3d-220f-4789-9c0a-cc742521fb02, http://data.europa.eu/esco/skill/034c29fa-c3ba-45ea-b8f3-bf8e3705e386, http://data.europa.eu/esco/skill/04f1b938-d4d4-4cb1-a863-982af76b9d93, http://data.europa.eu/esco/skill/0a9acb6b-1139-4be9-b431-3a80a959f2f4, http://data.europa.eu/esco/skill/0ccdfe98-f845-4598-84a1-3dca66e9d9a3, http://data.europa.eu/esco/skill/0cd6dcf1-5778-42a5-b685-4d01ae4a4871, http://data.europa.eu/esco/skill/0de61385-de6d-4146-ba32-1cc1bc102220, http://data.europa.eu/esco/skill/13bdd41a-2a18-441f-96db-41252c519413, http://data.europa.eu/esco/skill/19a8293b-8e95-4de3-983f-77484079c389, http://data.europa.eu/esco/skill/1b7c716e-af95-4cda-a42f-6479c8b139f5, http://data.europa.eu/esco/skill/21d2f96d-35f7-4e3f-9745-c533d2dd6e97, http://data.europa.eu/esco/skill/2bde42ae-e776-41c1-9ded-b07b30bfe985, http://data.europa.eu/esco/skill/300d432b-f457-4cd3-9cb1-1858c7d14954, http://data.europa.eu/esco/skill/3cd569a2-4f88-4c1e-9995-8dce8c5e51a7, http://data.europa.eu/esco/skill/3cee858e-79e8-4a4b-b99f-93c7f735d58b, http://data.europa.eu/esco/skill/3d03c40c-1b83-4793-8902-2523f40af59e, http://data.europa.eu/esco/skill/3f4dab51-572b-4e2c-85ef-3b4c3f7094e1, http://data.europa.eu/esco/skill/401eb8d8-6daa-4f8b-90ad-60afc71eb4f8, http://data.europa.eu/esco/skill/42ed3bfb-1a01-4c8b-9758-fc6438865734, http://data.europa.eu/esco/skill/4350c38d-0fe9-4ca7-bab9-40ed7f72b04f, http://data.europa.eu/esco/skill/43ec6db6-33f7-449b-a566-5779a7e8997a, http://data.europa.eu/esco/skill/47b9bbcf-356c-4782-83a4-7f5a1b2b51a3, http://data.europa.eu/esco/skill/48db96bf-3314-45c6-bad8-fdb6e20e5639, http://data.europa.eu/esco/skill/4959697d-3a24-4f46-af0c-b752318e6c54, http://data.europa.eu/esco/skill/4c016b68-4116-468c-9dc6-42710c239e4a, http://data.europa.eu/esco/skill/4da171e5-779c-4983-a76f-91c16751e99f, http://data.europa.eu/esco/skill/4e6d2538-a48e-48a7-8dad-14b067cfcb8b, http://data.europa.eu/esco/skill/51586df8-1c46-4b47-8583-773cb63bf00b, http://data.europa.eu/esco/skill/52cf3037-ab53-4806-85ed-7fd21ea7f6a1, http://data.europa.eu/esco/skill/56a7f561-1d55-43c9-9cd7-36a0a9bc6c50, http://data.europa.eu/esco/skill/58d7a289-dafd-4363-833f-d1dc4140885e, http://data.europa.eu/esco/skill/5da8018b-ae85-4cde-ad93-0394369018f3, http://data.europa.eu/esco/skill/70de94f5-9575-4edd-bca7-c797b023b9d6, http://data.europa.eu/esco/skill/8369ede5-4200-4a44-be2e-bc60ef959259, http://data.europa.eu/esco/skill/84251cb1-babf-4d17-a3cd-baa642c24c8d, http://data.europa.eu/esco/skill/867137fb-ff1b-4ca3-99f3-cb6969aa2c68, http://data.europa.eu/esco/skill/993b1e23-f2de-4bd8-b33f-f86dde1c8e9d, http://data.europa.eu/esco/skill/9973a5a2-7822-4161-99e9-95c781eb63f8, http://data.europa.eu/esco/skill/a4d336a6-9ffd-402a-91cc-f359716ba4e0, http://data.europa.eu/esco/skill/a57a54b6-2f2e-43e4-9621-b52f4a63cb08, http://data.europa.eu/esco/skill/a8d07b5a-c1a1-42c6-9d53-db9c7a2ca996, http://data.europa.eu/esco/skill/b4dc6e4f-dc7d-445f-8ce2-d7b9d225e282, http://data.europa.eu/esco/skill/b633eb55-8f1f-4ae6-ab4c-2022ffe2cb7f, http://data.europa.eu/esco/skill/b8eb2517-37d8-43e6-9856-9c29d5c51fde, http://data.europa.eu/esco/skill/bb99af26-71ff-4dca-bde7-1eb1f6194426, http://data.europa.eu/esco/skill/be80acfc-b6f2-4411-9b8d-b19d9cd2556a, http://data.europa.eu/esco/skill/bec4359e-cb92-468f-a997-8fb28e32fba9, http://data.europa.eu/esco/skill/c062bab3-3ea0-4291-9220-a2d8fef4bead, http://data.europa.eu/esco/skill/c3a03c5a-c260-4c26-9b9a-873abb396f4d, http://data.europa.eu/esco/skill/c5e8abde-d2ba-4e8e-a65e-720b71180666, http://data.europa.eu/esco/skill/c5ed451b-ef39-47a3-aee7-8f5be0aa8431, http://data.europa.eu/esco/skill/c7d24594-0c11-4b27-9039-fe0bb903da8e, http://data.europa.eu/esco/skill/ccd0a1d9-afda-43d9-b901-96344886e14d, http://data.europa.eu/esco/skill/d56fc2b5-4b0a-4e7e-9bde-a33736f6ff18, http://data.europa.eu/esco/skill/d5a59ca8-2e91-472e-8571-d12ce4478679, http://data.europa.eu/esco/skill/d9eaf831-9348-4330-a83e-b7c099cdc8f6, http://data.europa.eu/esco/skill/da6393d5-a53c-4863-abc7-51f36281d74e, http://data.europa.eu/esco/skill/dcdd5ddf-82a6-4ac3-8edc-d4b23cae9a88, http://data.europa.eu/esco/skill/de9f85ba-e77f-48fd-8c66-f5ebaf32d655, http://data.europa.eu/esco/skill/def007fa-5fed-4a5f-91a2-b0d7e3db1be1, http://data.europa.eu/esco/skill/e819cc1e-09d9-47f2-b418-93972852daef, http://data.europa.eu/esco/skill/e8b89eb6-51e8-4c3a-babb-88b2e110376b, http://data.europa.eu/esco/skill/eb0e5615-1575-4a86-a1a2-7d39595033c5, http://data.europa.eu/esco/skill/edebd83d-35f6-4ed5-a940-6c203d178c01, http://data.europa.eu/esco/skill/f597f772-24d3-4cec-813c-cf5a7027c794, http://data.europa.eu/esco/skill/fecf8a0d-62c4-4e71-9b03-0f4fc2ad7bf5, http://data.europa.eu/esco/skill/ffddfc7c-a9dd-449f-9e96-882dc447c8b6, http://data.europa.eu/esco/skill/022dc430-872a-473a-9cf4-fed4895e58ad, http://data.europa.eu/esco/skill/4463a721-69f3-413d-8321-43e3af13a4f1, http://data.europa.eu/esco/skill/5da73370-f6b9-417d-a94c-09bf01f84aa2, http://data.europa.eu/esco/skill/7e796b51-49d7-4e73-95af-2e7323763f15, http://data.europa.eu/esco/skill/ab67fbfb-0ca7-4345-8bf6-af8f59480212, http://data.europa.eu/esco/skill/c32ad607-0c4d-4e34-b73f-668298f7bf13, http://data.europa.eu/esco/skill/d3286405-49f8-4e8a-8046-a4376b4e7963, http://data.europa.eu/esco/skill/dc72ad0a-c5dc-4abd-bc0d-ca43e82162e1, http://data.europa.eu/esco/skill/f5dd06b8-5d17-4932-9d03-957d0c4f5051",2521,"python, bash, sql, mysql, postgresql, oracle, sql server, sqlite, mongodb, cassandra, redis, dynamodb, neo4j, elasticsearch, etl, data pipelines, data warehousing, aws, google cloud, microsoft azure, dynamodb, linux, git"
http://data.europa.eu/esco/occupation/96e20037-0a25-4bf6-a25e-808d1605d890,user interface designer,"software UI design patterns, interactive media, ICT accessibility standards, web programming, task algorithmisation, ICT security legislation, World Wide Web Consortium standards, human-computer interaction, graphics editor software, application usability, software interaction design, use an application-specific interface, use markup languages, design process, translate requirements into visual design, assess users' interaction with ICT applications, use methodologies for user-centered design, develop creative ideas, interact with users to gather requirements, test system accessibility for users with special needs, manage online content, define technical requirements, build business relationships, design graphics, create website wireframe, draw design sketches, design user interface, Haskell, incremental development, Erlang, SAS language, Agile project management, Ruby (computer programming), Common Lisp, Lisp, Visual Basic, Adobe Photoshop, screen reader, Java (computer programming), computer programming, cognitive psychology, Adobe Illustrator, Prolog (computer programming), OpenEdge Advanced Business Language, iterative development, JavaScript, Perl, Smalltalk (computer programming), PHP, Assembly (computer programming), Spiral development, GIMP (graphics editor software), C#, R, Groovy, ASP.NET, APL, Waterfall development, SketchBook Pro, TypeScript, Microsoft Visio, quality standards, software design methodologies, web based collaborative platforms, Rapid application development, business process modelling, CoffeeScript, Objective-C, ML (computer programming), augmented reality, Synfig, AJAX, C++, SAP R3, Swift (computer programming), ICT project management methodologies, MATLAB, Python (computer programming), Scratch (computer programming), Process-based management, lean project management, Agile development, VBScript, COBOL, Pascal (computer programming), ABAP, Prototyping development, DevOps, Scala, natural language processing, perform online data analysis, create software design, use query languages, manage localisation, analyse business requirements","essential, optional","knowledge, skill/competence","http://data.europa.eu/esco/skill/1019423b-3368-4f83-b24f-19e5fa23e816, http://data.europa.eu/esco/skill/123cf7c5-6a3b-419d-be4f-49a6cc020f9f, http://data.europa.eu/esco/skill/3e23db60-0c3d-498a-a6ac-ffbed0ecb033, http://data.europa.eu/esco/skill/69bbd53f-fbb0-4476-b4b2-ef7844464e28, http://data.europa.eu/esco/skill/7482a123-e801-48de-9733-262125671410, http://data.europa.eu/esco/skill/7814e88f-c133-4c3b-b27f-857afa145d42, http://data.europa.eu/esco/skill/8696aff0-18c0-4ba6-a4d0-9a21861b3e5e, http://data.europa.eu/esco/skill/9136cbf1-7916-4f1c-bc9a-0318ee1d6016, http://data.europa.eu/esco/skill/a71577b2-7550-4222-88ee-dcbd2d881516, http://data.europa.eu/esco/skill/c4b626c1-e71c-44ec-9f88-042766f37fcc, http://data.europa.eu/esco/skill/de0be6e8-644c-4cc9-9c8d-925dd98dda56, http://data.europa.eu/esco/skill/04fe962b-4017-4eb7-9139-7d69b6922bc9, http://data.europa.eu/esco/skill/0af062de-eb43-41e9-9b96-249e2cd22d26, http://data.europa.eu/esco/skill/2c28fc20-8a60-4311-8899-5ef8729c05b3, http://data.europa.eu/esco/skill/2d6d4784-0992-48e7-b100-22d7229b3f0a, http://data.europa.eu/esco/skill/465e7c78-cd26-4503-a5ca-40009e807705, http://data.europa.eu/esco/skill/7364cc39-b9c0-449f-9416-57723e2fd9c4, http://data.europa.eu/esco/skill/8c4c49d4-9708-433f-8ca7-bf2c5211ee49, http://data.europa.eu/esco/skill/a8797f21-1af0-4c5e-98ca-bf1442929363, http://data.europa.eu/esco/skill/be64bb4c-84ac-4c83-8cc7-fc8593e15136, http://data.europa.eu/esco/skill/c1f29568-f2bb-49d2-b6c2-28748bd1629b, http://data.europa.eu/esco/skill/d9e5349e-8791-49c2-8ba4-839fdd1606c2, http://data.europa.eu/esco/skill/dc72ad0a-c5dc-4abd-bc0d-ca43e82162e1, http://data.europa.eu/esco/skill/f058bf62-70d1-4f5e-be2a-8b26fac24a96, http://data.europa.eu/esco/skill/f0f5bb34-71df-4715-9c9e-03567b76ec8f, http://data.europa.eu/esco/skill/fc4fcb4b-993f-4f2c-b158-c2171ec18ed8, http://data.europa.eu/esco/skill/fd33c66c-70c4-40e6-b87c-5495bd3bf26e, http://data.europa.eu/esco/skill/000f1d3d-220f-4789-9c0a-cc742521fb02, http://data.europa.eu/esco/skill/00c04e40-35ea-4ed1-824c-82f936c8f876, http://data.europa.eu/esco/skill/034c29fa-c3ba-45ea-b8f3-bf8e3705e386, http://data.europa.eu/esco/skill/04f1b938-d4d4-4cb1-a863-982af76b9d93, http://data.europa.eu/esco/skill/0a9acb6b-1139-4be9-b431-3a80a959f2f4, http://data.europa.eu/esco/skill/0ccdfe98-f845-4598-84a1-3dca66e9d9a3, http://data.europa.eu/esco/skill/0cd6dcf1-5778-42a5-b685-4d01ae4a4871, http://data.europa.eu/esco/skill/0de61385-de6d-4146-ba32-1cc1bc102220, http://data.europa.eu/esco/skill/13bdd41a-2a18-441f-96db-41252c519413, http://data.europa.eu/esco/skill/14ced458-5f4b-495f-bd3d-9c240614bda0, http://data.europa.eu/esco/skill/1774bd31-8893-44cf-9498-7e3d95508419, http://data.europa.eu/esco/skill/19a8293b-8e95-4de3-983f-77484079c389, http://data.europa.eu/esco/skill/21d2f96d-35f7-4e3f-9745-c533d2dd6e97, http://data.europa.eu/esco/skill/2618f336-8e71-4666-83b5-f368edb0906d, http://data.europa.eu/esco/skill/27b913f0-3c52-448b-ad27-fc6ef08fb326, http://data.europa.eu/esco/skill/2bde42ae-e776-41c1-9ded-b07b30bfe985, http://data.europa.eu/esco/skill/300d432b-f457-4cd3-9cb1-1858c7d14954, http://data.europa.eu/esco/skill/33d49d4f-31ec-473f-9b8a-b555aa5116bb, http://data.europa.eu/esco/skill/3cd569a2-4f88-4c1e-9995-8dce8c5e51a7, http://data.europa.eu/esco/skill/401eb8d8-6daa-4f8b-90ad-60afc71eb4f8, http://data.europa.eu/esco/skill/42ed3bfb-1a01-4c8b-9758-fc6438865734, http://data.europa.eu/esco/skill/4350c38d-0fe9-4ca7-bab9-40ed7f72b04f, http://data.europa.eu/esco/skill/47b9bbcf-356c-4782-83a4-7f5a1b2b51a3, http://data.europa.eu/esco/skill/4840338b-ac6c-486a-be1d-9ddfe00b8bdf, http://data.europa.eu/esco/skill/4a466c62-db7d-4905-9a41-f23214810acb, http://data.europa.eu/esco/skill/4c016b68-4116-468c-9dc6-42710c239e4a, http://data.europa.eu/esco/skill/51586df8-1c46-4b47-8583-773cb63bf00b, http://data.europa.eu/esco/skill/52cf3037-ab53-4806-85ed-7fd21ea7f6a1, http://data.europa.eu/esco/skill/56a7f561-1d55-43c9-9cd7-36a0a9bc6c50, http://data.europa.eu/esco/skill/58d7a289-dafd-4363-833f-d1dc4140885e, http://data.europa.eu/esco/skill/6a876489-7ad8-4a13-b09c-c9b8e97a302e, http://data.europa.eu/esco/skill/85038d57-1fdd-40de-b908-2c005545a8c3, http://data.europa.eu/esco/skill/867137fb-ff1b-4ca3-99f3-cb6969aa2c68, http://data.europa.eu/esco/skill/86f7126d-97fd-4da5-be96-d1cf6ecd54e6, http://data.europa.eu/esco/skill/8d4271ca-c9fd-40b3-875f-15f78332a49e, http://data.europa.eu/esco/skill/8ff015a0-98ea-4d80-a23e-1f68110a919e, http://data.europa.eu/esco/skill/93e65de1-923c-437e-aa5b-e6002967ce71, http://data.europa.eu/esco/skill/96eb286a-58b7-45ff-a916-5578d0b79b8c, http://data.europa.eu/esco/skill/98301d4a-2cc3-439d-8d7f-0b6ac76302bb, http://data.europa.eu/esco/skill/993b1e23-f2de-4bd8-b33f-f86dde1c8e9d, http://data.europa.eu/esco/skill/9973a5a2-7822-4161-99e9-95c781eb63f8, http://data.europa.eu/esco/skill/a4d336a6-9ffd-402a-91cc-f359716ba4e0, http://data.europa.eu/esco/skill/abdc7ac8-151f-40c6-bc1a-1e9b4b073290, http://data.europa.eu/esco/skill/b0ac313d-de44-4344-ada6-76d2177b6d92, http://data.europa.eu/esco/skill/b4dc6e4f-dc7d-445f-8ce2-d7b9d225e282, http://data.europa.eu/esco/skill/b633eb55-8f1f-4ae6-ab4c-2022ffe2cb7f, http://data.europa.eu/esco/skill/bb99af26-71ff-4dca-bde7-1eb1f6194426, http://data.europa.eu/esco/skill/be80acfc-b6f2-4411-9b8d-b19d9cd2556a, http://data.europa.eu/esco/skill/bec4359e-cb92-468f-a997-8fb28e32fba9, http://data.europa.eu/esco/skill/c3a03c5a-c260-4c26-9b9a-873abb396f4d, http://data.europa.eu/esco/skill/ccd0a1d9-afda-43d9-b901-96344886e14d, http://data.europa.eu/esco/skill/d56fc2b5-4b0a-4e7e-9bde-a33736f6ff18, http://data.europa.eu/esco/skill/d5a59ca8-2e91-472e-8571-d12ce4478679, http://data.europa.eu/esco/skill/da6393d5-a53c-4863-abc7-51f36281d74e, http://data.europa.eu/esco/skill/dba46f87-0831-49cd-a1c7-340a653c0221, http://data.europa.eu/esco/skill/dcdd5ddf-82a6-4ac3-8edc-d4b23cae9a88, http://data.europa.eu/esco/skill/def007fa-5fed-4a5f-91a2-b0d7e3db1be1, http://data.europa.eu/esco/skill/e8b89eb6-51e8-4c3a-babb-88b2e110376b, http://data.europa.eu/esco/skill/eb0e5615-1575-4a86-a1a2-7d39595033c5, http://data.europa.eu/esco/skill/ed1d8bd4-cd2a-4c64-b665-56d70651026c, http://data.europa.eu/esco/skill/f0de4973-0a70-4644-8fd4-3a97080476f4, http://data.europa.eu/esco/skill/ffddfc7c-a9dd-449f-9e96-882dc447c8b6, http://data.europa.eu/esco/skill/fff0e2cd-d0bd-4b02-9daf-158b79d9688a, http://data.europa.eu/esco/skill/062320e5-79d1-45e8-8b7e-5deeb53279a2, http://data.europa.eu/esco/skill/3bddfd7c-ab6d-40c2-883d-5e97fb7640ba, http://data.europa.eu/esco/skill/75f839c2-fd9a-4ad3-8921-6e734608568d, http://data.europa.eu/esco/skill/a9bf8565-8a09-4118-9922-932d65a79d69, http://data.europa.eu/esco/skill/b04f377b-ee80-4b38-aca1-19d266a23b17",2513,"css, agile, react, bootstrap, sass, tailwind, less, javascript, git, html, vue"
http://data.europa.eu/esco/occupation/9729c0f3-c9bc-482e-ac59-a82ec3b67ba3,data centre operator,"resource description framework query language, query languages, database management systems, migrate existing data, administer ICT system, keep up with the latest information systems solutions, manage database, analyse ICT system, monitor system performance, balance database resources, maintain database performance, maintain database security, maintain ICT server, develop contingency plans for emergencies, MDX, DB2, Microsoft Access, XQuery, OpenEdge Database, ObjectStore, MySQL, SPARQL, IBM Informix, World Wide Web Consortium standards, database development tools, information confidentiality, LDAP, data storage, PostgreSQL, Filemaker (database management systems), SQL Server, unstructured data, CA Datacom/DB, LINQ, business ICT systems, Teradata Database, N1QL, data models, create solutions to problems, develop automated migration methods, use different communication channels, use databases, use ICT ticketing system, use back-up and recovery tools, implement a virtual private network, implement anti-virus software, control of expenses, implement a firewall, integrate system components","essential, optional","knowledge, skill/competence","http://data.europa.eu/esco/skill/99207709-d076-4cce-ba38-e90d3bb28806, http://data.europa.eu/esco/skill/9cf681c7-89ec-470c-b651-7fe03786f586, http://data.europa.eu/esco/skill/ab1e97ed-2319-4293-a8b7-072d2648822f, http://data.europa.eu/esco/skill/020918ef-4b55-47c1-8430-ab7b8f6a7377, http://data.europa.eu/esco/skill/0868eef3-2213-4572-9343-74931345a7d3, http://data.europa.eu/esco/skill/20c920d4-7ff7-4676-ba61-3f04490d9416, http://data.europa.eu/esco/skill/29fb0fb5-dfc4-4098-ac9b-3a712000f48f, http://data.europa.eu/esco/skill/7adb8473-bcc6-4ff8-9850-76d945d40092, http://data.europa.eu/esco/skill/9190d87f-9792-42e0-bb7f-64294a656bcd, http://data.europa.eu/esco/skill/9ba8fd27-275d-4bad-8c48-f668aa99a578, http://data.europa.eu/esco/skill/d6cdef49-b669-4507-91d1-3f959cf98e47, http://data.europa.eu/esco/skill/ec85cc63-4e24-4631-bf92-8789db2605c0, http://data.europa.eu/esco/skill/f5ac9226-0ace-4d34-a1c3-7b3845834a98, http://data.europa.eu/esco/skill/fa3567c8-a7c1-40de-bac0-a4f5a85b9f1a, http://data.europa.eu/esco/skill/1b7c716e-af95-4cda-a42f-6479c8b139f5, http://data.europa.eu/esco/skill/3cee858e-79e8-4a4b-b99f-93c7f735d58b, http://data.europa.eu/esco/skill/3d03c40c-1b83-4793-8902-2523f40af59e, http://data.europa.eu/esco/skill/3f4dab51-572b-4e2c-85ef-3b4c3f7094e1, http://data.europa.eu/esco/skill/43ec6db6-33f7-449b-a566-5779a7e8997a, http://data.europa.eu/esco/skill/4959697d-3a24-4f46-af0c-b752318e6c54, http://data.europa.eu/esco/skill/4da171e5-779c-4983-a76f-91c16751e99f, http://data.europa.eu/esco/skill/5da8018b-ae85-4cde-ad93-0394369018f3, http://data.europa.eu/esco/skill/84251cb1-babf-4d17-a3cd-baa642c24c8d, http://data.europa.eu/esco/skill/8696aff0-18c0-4ba6-a4d0-9a21861b3e5e, http://data.europa.eu/esco/skill/9ef0f3a0-9ce2-4ef1-a987-0366b5cb2dbe, http://data.europa.eu/esco/skill/a56dec32-05ef-45de-a256-ee6741f356db, http://data.europa.eu/esco/skill/a57a54b6-2f2e-43e4-9621-b52f4a63cb08, http://data.europa.eu/esco/skill/a7f0fbe0-c546-4f30-8e41-34a58c64567e, http://data.europa.eu/esco/skill/a8d07b5a-c1a1-42c6-9d53-db9c7a2ca996, http://data.europa.eu/esco/skill/b8eb2517-37d8-43e6-9856-9c29d5c51fde, http://data.europa.eu/esco/skill/c062bab3-3ea0-4291-9220-a2d8fef4bead, http://data.europa.eu/esco/skill/c5e8abde-d2ba-4e8e-a65e-720b71180666, http://data.europa.eu/esco/skill/c5ed451b-ef39-47a3-aee7-8f5be0aa8431, http://data.europa.eu/esco/skill/c7d24594-0c11-4b27-9039-fe0bb903da8e, http://data.europa.eu/esco/skill/ccdbd9bb-4faf-403c-a968-e8bf487f8a53, http://data.europa.eu/esco/skill/d9eaf831-9348-4330-a83e-b7c099cdc8f6, http://data.europa.eu/esco/skill/f597f772-24d3-4cec-813c-cf5a7027c794, http://data.europa.eu/esco/skill/fecf8a0d-62c4-4e71-9b03-0f4fc2ad7bf5, http://data.europa.eu/esco/skill/03b9b491-fc9b-4868-914a-bf7cd47b5041, http://data.europa.eu/esco/skill/0b0335f3-0aa1-491e-895e-81fc8774a300, http://data.europa.eu/esco/skill/415abd43-e8e5-4643-b5da-5f11307af57a, http://data.europa.eu/esco/skill/4463a721-69f3-413d-8321-43e3af13a4f1, http://data.europa.eu/esco/skill/6430eb0d-c6de-46b7-a7fc-3dd2e8e62a69, http://data.europa.eu/esco/skill/82de2df7-0d6c-42b1-94ac-b3e9a029e917, http://data.europa.eu/esco/skill/acf0a78c-f4e3-4bd9-a5cc-9cf4791b3b95, http://data.europa.eu/esco/skill/bb2b4485-2bad-402f-8517-44bf7d9afff4, http://data.europa.eu/esco/skill/e1f5c539-7c93-49ee-917d-a24e0d887686, http://data.europa.eu/esco/skill/e5b5053e-0ef6-4c4e-a3f2-42f955f4322c, http://data.europa.eu/esco/skill/ed8de897-adbe-4f0e-b4d2-534953e64c72",3511,"python, r, sql, data analysis, data mining, data visualization, statistical analysis, predictive modeling, feature engineering, data wrangling, pandas, numpy, scipy, matplotlib, seaborn, plotly, jupyter, anaconda, google colab, machine learning, deep learning, tensorflow, keras, pytorch, scikit-learn, xgboost, lightgbm, hadoop, spark, pyspark, hive, kafka, etl, data pipelines, data warehousing, data lakes, apache airflow, dbt, aws, google cloud, microsoft azure, bigquery, redshift, git, github, tableau, power bi, looker, data studio"
