occupationUri,occupationLabel,skillLabel,relationType,skillType,skillUri,iscoGroup,mapped_skills
http://data.europa.eu/esco/occupation/35553663-deab-4d9a-bf22-15c1625d28e8,artificial intelligence engineer,"digital data processing, information structure, computer simulation, systems development life-cycle, information architecture, computer programming, data mining, visual presentation techniques, algorithms, artificial neural networks, information extraction, task algorithmisation, information categorisation, business process modelling, resource description framework query language, unstructured data, Python (computer programming), principles of artificial intelligence, data science, data models, creatively use digital technologies, use data processing techniques, design process, analyse big data, develop creative ideas, create data sets, analyse business requirements, develop statistical software, deliver visual presentation of data, apply ICT systems theory, define technical requirements, Haskell, Erlang, SAS language, Agile project management, Ruby (computer programming), Common Lisp, Lisp, Visual Basic, business intelligence, Java (computer programming), Prolog (computer programming), OpenEdge Advanced Business Language, JavaScript, Perl, Smalltalk (computer programming), PHP, Assembly (computer programming), C#, R, Groovy, SPARQL, operational research, computer vision, Microsoft Visual C++, TypeScript, business analytics, CoffeeScript, Objective-C, database development tools, ML (computer programming), C++, SAP R3, Swift (computer programming), ICT project management methodologies, MATLAB, LINQ, Scratch (computer programming), Process-based management, lean project management, VBScript, COBOL, Pascal (computer programming), deep learning, N1QL, Scala, manage ICT data classification, assess ICT knowledge, build predictive models, perform dimensionality reduction, manage business knowledge, apply systemic design thinking, build recommender systems, identify processes for re-engineering, design database scheme, utilise machine learning, design application interfaces, build business relationships, manage ICT semantic integration","essential, optional","knowledge, skill/competence","http://data.europa.eu/esco/skill/629685b8-5f9e-4522-8cff-b3e2c4ec625a, http://data.europa.eu/esco/skill/03ff0d53-573a-47a0-a0ad-1995815a4339, http://data.europa.eu/esco/skill/0823ccef-813f-4f22-afef-ac0d68615e8f, http://data.europa.eu/esco/skill/09f2f811-a3fb-4de3-a70f-6420a6935575, http://data.europa.eu/esco/skill/1bba98a7-92b9-450b-9235-e0c905f8f3c4, http://data.europa.eu/esco/skill/21d2f96d-35f7-4e3f-9745-c533d2dd6e97, http://data.europa.eu/esco/skill/25f0ea33-b4a2-4f31-b7b4-7d20e827b180, http://data.europa.eu/esco/skill/348b74cd-49ce-4844-8bdf-ec188b497213, http://data.europa.eu/esco/skill/54924a2c-daca-40d3-9716-4b38ceb04f38, http://data.europa.eu/esco/skill/5608d5a0-6d5e-43b7-be37-616501729bb4, http://data.europa.eu/esco/skill/696e3b5b-8b61-45af-ae4c-3ab700f197ec, http://data.europa.eu/esco/skill/7482a123-e801-48de-9733-262125671410, http://data.europa.eu/esco/skill/93aaf65c-5aad-4e6f-a7ba-ce9bf7c0e6e6, http://data.europa.eu/esco/skill/98301d4a-2cc3-439d-8d7f-0b6ac76302bb, http://data.europa.eu/esco/skill/99207709-d076-4cce-ba38-e90d3bb28806, http://data.europa.eu/esco/skill/c5e8abde-d2ba-4e8e-a65e-720b71180666, http://data.europa.eu/esco/skill/ccd0a1d9-afda-43d9-b901-96344886e14d, http://data.europa.eu/esco/skill/e465a154-93f7-4973-9ce1-31659fe16dd2, http://data.europa.eu/esco/skill/edebd83d-35f6-4ed5-a940-6c203d178c01, http://data.europa.eu/esco/skill/fecf8a0d-62c4-4e71-9b03-0f4fc2ad7bf5, http://data.europa.eu/esco/skill/1a4cc54f-1e53-442b-a6d2-1682dc8ef8f9, http://data.europa.eu/esco/skill/1b70a55d-b8a4-49fc-96c6-15ab4cff2522, http://data.europa.eu/esco/skill/2c28fc20-8a60-4311-8899-5ef8729c05b3, http://data.europa.eu/esco/skill/47a49cd6-097d-457a-9f7b-c290c14930d5, http://data.europa.eu/esco/skill/8c4c49d4-9708-433f-8ca7-bf2c5211ee49, http://data.europa.eu/esco/skill/906323f4-00c4-4c3b-ab5a-8af77be3456e, http://data.europa.eu/esco/skill/b04f377b-ee80-4b38-aca1-19d266a23b17, http://data.europa.eu/esco/skill/bb165899-d95f-4433-95f2-173fefd716d2, http://data.europa.eu/esco/skill/c3e36d05-8ae8-447f-bb2b-6f9409f85389, http://data.europa.eu/esco/skill/cbe2c304-1e7d-489a-97d9-a7d3e37a9db6, http://data.europa.eu/esco/skill/d9e5349e-8791-49c2-8ba4-839fdd1606c2, http://data.europa.eu/esco/skill/000f1d3d-220f-4789-9c0a-cc742521fb02, http://data.europa.eu/esco/skill/034c29fa-c3ba-45ea-b8f3-bf8e3705e386, http://data.europa.eu/esco/skill/04f1b938-d4d4-4cb1-a863-982af76b9d93, http://data.europa.eu/esco/skill/0a9acb6b-1139-4be9-b431-3a80a959f2f4, http://data.europa.eu/esco/skill/0ccdfe98-f845-4598-84a1-3dca66e9d9a3, http://data.europa.eu/esco/skill/0cd6dcf1-5778-42a5-b685-4d01ae4a4871, http://data.europa.eu/esco/skill/0de61385-de6d-4146-ba32-1cc1bc102220, http://data.europa.eu/esco/skill/13bdd41a-2a18-441f-96db-41252c519413, http://data.europa.eu/esco/skill/143769cb-b61e-47d8-a61e-eedfbec1016c, http://data.europa.eu/esco/skill/19a8293b-8e95-4de3-983f-77484079c389, http://data.europa.eu/esco/skill/2bde42ae-e776-41c1-9ded-b07b30bfe985, http://data.europa.eu/esco/skill/300d432b-f457-4cd3-9cb1-1858c7d14954, http://data.europa.eu/esco/skill/3cd569a2-4f88-4c1e-9995-8dce8c5e51a7, http://data.europa.eu/esco/skill/401eb8d8-6daa-4f8b-90ad-60afc71eb4f8, http://data.europa.eu/esco/skill/42ed3bfb-1a01-4c8b-9758-fc6438865734, http://data.europa.eu/esco/skill/4350c38d-0fe9-4ca7-bab9-40ed7f72b04f, http://data.europa.eu/esco/skill/47b9bbcf-356c-4782-83a4-7f5a1b2b51a3, http://data.europa.eu/esco/skill/4c016b68-4116-468c-9dc6-42710c239e4a, http://data.europa.eu/esco/skill/51586df8-1c46-4b47-8583-773cb63bf00b, http://data.europa.eu/esco/skill/52cf3037-ab53-4806-85ed-7fd21ea7f6a1, http://data.europa.eu/esco/skill/5da8018b-ae85-4cde-ad93-0394369018f3, http://data.europa.eu/esco/skill/726abd5a-d23c-44b9-abb0-f22bbe95f1d3, http://data.europa.eu/esco/skill/7b0d5000-00da-4864-b776-6de49a87a669, http://data.europa.eu/esco/skill/8369ede5-4200-4a44-be2e-bc60ef959259, http://data.europa.eu/esco/skill/867137fb-ff1b-4ca3-99f3-cb6969aa2c68, http://data.europa.eu/esco/skill/98a1dec3-8138-4f46-a596-5e2a83b884b9, http://data.europa.eu/esco/skill/993b1e23-f2de-4bd8-b33f-f86dde1c8e9d, http://data.europa.eu/esco/skill/9973a5a2-7822-4161-99e9-95c781eb63f8, http://data.europa.eu/esco/skill/9ef0f3a0-9ce2-4ef1-a987-0366b5cb2dbe, http://data.europa.eu/esco/skill/a4d336a6-9ffd-402a-91cc-f359716ba4e0, http://data.europa.eu/esco/skill/b633eb55-8f1f-4ae6-ab4c-2022ffe2cb7f, http://data.europa.eu/esco/skill/bb99af26-71ff-4dca-bde7-1eb1f6194426, http://data.europa.eu/esco/skill/be80acfc-b6f2-4411-9b8d-b19d9cd2556a, http://data.europa.eu/esco/skill/bec4359e-cb92-468f-a997-8fb28e32fba9, http://data.europa.eu/esco/skill/c3a03c5a-c260-4c26-9b9a-873abb396f4d, http://data.europa.eu/esco/skill/c7d24594-0c11-4b27-9039-fe0bb903da8e, http://data.europa.eu/esco/skill/d56fc2b5-4b0a-4e7e-9bde-a33736f6ff18, http://data.europa.eu/esco/skill/d5a59ca8-2e91-472e-8571-d12ce4478679, http://data.europa.eu/esco/skill/da6393d5-a53c-4863-abc7-51f36281d74e, http://data.europa.eu/esco/skill/dcdd5ddf-82a6-4ac3-8edc-d4b23cae9a88, http://data.europa.eu/esco/skill/def007fa-5fed-4a5f-91a2-b0d7e3db1be1, http://data.europa.eu/esco/skill/e8b89eb6-51e8-4c3a-babb-88b2e110376b, http://data.europa.eu/esco/skill/ecc4552a-92c5-4222-b18d-faf5ac841080, http://data.europa.eu/esco/skill/f597f772-24d3-4cec-813c-cf5a7027c794, http://data.europa.eu/esco/skill/ffddfc7c-a9dd-449f-9e96-882dc447c8b6, http://data.europa.eu/esco/skill/03a74eee-2dc6-4147-8667-5cdeb65f122d, http://data.europa.eu/esco/skill/0dc7aa1b-b5af-4f4b-81ce-ee22ed8b6926, http://data.europa.eu/esco/skill/38d49d88-9069-467b-b29e-3cae739bdd4d, http://data.europa.eu/esco/skill/3e2ab38a-4519-4bef-b762-a8bf4836a775, http://data.europa.eu/esco/skill/41bf7ede-fc84-4a57-8c89-b548d11b0ba1, http://data.europa.eu/esco/skill/4d30ad07-9e39-4899-81dd-02b280f162f9, http://data.europa.eu/esco/skill/505e4ef3-7ce4-437d-b7b4-5c608f71c258, http://data.europa.eu/esco/skill/553ad092-b799-44c9-a94c-65a84fdc7526, http://data.europa.eu/esco/skill/6c08403c-a5bb-4868-b8c2-b7d039c0e511, http://data.europa.eu/esco/skill/8369c2d6-c100-4cf6-bd83-9668d8678433, http://data.europa.eu/esco/skill/b0096dc5-2e2d-4bc1-8172-05bf486c3968, http://data.europa.eu/esco/skill/dc72ad0a-c5dc-4abd-bc0d-ca43e82162e1, http://data.europa.eu/esco/skill/fda917eb-0d6a-4371-8c93-2a10bf950966",2511,"python, r, data analysis, data visualization, pandas, numpy, jupyter, machine learning, supervised learning, unsupervised learning, reinforcement learning, classification, regression, clustering, model evaluation, feature selection, model deployment, deep learning, neural networks, cnn, rnn, transformers, computer vision, natural language processing, tensorflow, keras, pytorch, scikit-learn, xgboost, lightgbm, huggingface, spacy, nltk, opencv, aws, google cloud, docker, git, github, langchain, llamaindex, prompt engineering, vector databases, faiss, pinecone, weaviate, mlops, model monitoring, model versioning, kubeflow, mlflow, dvc"
http://data.europa.eu/esco/occupation/36095ccd-c62d-4f1f-8af7-1fd10618b044,sound editor,"musical genres, film music techniques, audio editing software, musical theory, copyright legislation, follow work schedule, consult with production director, familiarise with personal directing styles, structure soundtrack, finish project within budget, synchronise sound with images, analyse a script, search databases, follow directions of the artistic director, coordinate music with scenes, edit recorded sound, attend music recording sessions, musical instruments, film production process, musical notation, file-based workflow, draw up artistic production, transpose music, engage composers, purchase music, rewrite musical scores, organise compositions, synchronise with mouth movements, archive documentation related to work, collaborate with music librarians, draft music cue breakdown, transcribe ideas into musical notation, work with composers","essential, optional","knowledge, skill/competence","http://data.europa.eu/esco/skill/52eb7ab6-269f-4f44-a21d-b0c705eaf857, http://data.europa.eu/esco/skill/684927a3-1d71-4b87-abb4-db204bb87086, http://data.europa.eu/esco/skill/cae4c053-05d1-413d-8499-f37793aad56e, http://data.europa.eu/esco/skill/d11e4683-d2fe-45fd-bb1a-e995f7877851, http://data.europa.eu/esco/skill/e2103a1d-4a84-47a9-b4f7-774787573449, http://data.europa.eu/esco/skill/194c05ed-253c-485a-8bf0-0c8de1aaafda, http://data.europa.eu/esco/skill/24229e89-9e1d-4c1a-ae23-c64777b152ce, http://data.europa.eu/esco/skill/42f977aa-a6eb-4994-b368-d5f26c0fd1fa, http://data.europa.eu/esco/skill/6f7aafee-02e4-4484-9eae-1106b8575f88, http://data.europa.eu/esco/skill/7d092d81-d1e2-4c34-b3cb-c1c9f2e68b7d, http://data.europa.eu/esco/skill/80e961f6-1482-4a28-9810-941b8aea1e86, http://data.europa.eu/esco/skill/97db841c-31bf-4aa0-85b9-0ddd0a77b7a5, http://data.europa.eu/esco/skill/a1388163-462a-4b76-8649-67470ea858a1, http://data.europa.eu/esco/skill/b31ccede-907f-49de-8047-4d851bd4add3, http://data.europa.eu/esco/skill/bc010c93-498c-4362-958b-943df3608add, http://data.europa.eu/esco/skill/c2218533-3e2a-4f50-b4fd-afde71dcf442, http://data.europa.eu/esco/skill/c70bfec4-9a2e-4f22-a362-79c2ea17ee9b, http://data.europa.eu/esco/skill/29d4aaba-99f9-4733-bd74-ad558f2ae3a7, http://data.europa.eu/esco/skill/493b20c2-c435-449a-896e-0af057c41fef, http://data.europa.eu/esco/skill/6339a2d3-0c34-4156-b202-5929764fb720, http://data.europa.eu/esco/skill/a35b9b1c-ebfe-41ac-96be-2a7b2ea04670, http://data.europa.eu/esco/skill/02c7caf4-4e8b-4745-8917-dbbd3af17c28, http://data.europa.eu/esco/skill/332da224-6261-4caf-a38a-0f81001fddcc, http://data.europa.eu/esco/skill/3e46974a-0f75-48d7-97c0-ff316f4862f6, http://data.europa.eu/esco/skill/45530616-8275-4a9a-9bf1-3e0df737d199, http://data.europa.eu/esco/skill/4d86a331-4efc-4c2f-bd94-0ebeda54d013, http://data.europa.eu/esco/skill/5bdb8e03-04ab-4869-a48f-3b013b5a2c3c, http://data.europa.eu/esco/skill/5c48050b-c4ca-467e-a4d3-9547bf362a17, http://data.europa.eu/esco/skill/6451e645-67b5-4cc7-aafd-fab19629fa82, http://data.europa.eu/esco/skill/7e1fe870-945c-4532-bf59-e94caf54b6f8, http://data.europa.eu/esco/skill/9af0815a-39da-4a99-8c28-b0fe8baf3db6, http://data.europa.eu/esco/skill/ac49be50-5cfa-42d7-b6cb-751e5bda2ac1, http://data.europa.eu/esco/skill/c6ce2d77-ba89-432f-87dd-f1d36557fc95",3521,"python, bash, linux, git"
http://data.europa.eu/esco/occupation/3b1ea27c-781c-41eb-821f-214285260dd2,ICT change and configuration manager,"digital systems, tools for software configuration management, ICT project management methodologies, project configuration management, DevOps, ICT process quality models, administer ICT system, develop automated migration methods, manage changes in ICT system, use scripting programming, deploy ICT systems, manage software releases, manage ICT virtualisation environments, perform project management, build business relationships, train employees, integrate system components, Apache Maven, embedded systems, computer programming, Octopus Deploy, Chef (tools for software configuration management), Codenvy, Puppet (tools for software configuration management), STAF, Vagrant, integrated development environment software, control objectives for information and related technology, Salt (tools for software configuration management), Jenkins (tools for software configuration management), migrate existing data, design cloud architecture, utilise computer-aided software engineering tools, perform software unit testing, apply operations for an ITIL-based environment, perform software recovery testing","essential, optional","knowledge, skill/competence","http://data.europa.eu/esco/skill/397da142-ab35-48fe-b154-7c38f447adfb, http://data.europa.eu/esco/skill/9d2e926f-53d9-41f5-98f3-19dfaa687f3f, http://data.europa.eu/esco/skill/bec4359e-cb92-468f-a997-8fb28e32fba9, http://data.europa.eu/esco/skill/ccb2e5f2-4279-48fd-9d85-a1db42ff1e13, http://data.europa.eu/esco/skill/f0de4973-0a70-4644-8fd4-3a97080476f4, http://data.europa.eu/esco/skill/fafe0b9d-dbd9-46bd-b770-26299539ce66, http://data.europa.eu/esco/skill/0868eef3-2213-4572-9343-74931345a7d3, http://data.europa.eu/esco/skill/0b0335f3-0aa1-491e-895e-81fc8774a300, http://data.europa.eu/esco/skill/1e7ed56a-6d6b-422f-962e-38543d150755, http://data.europa.eu/esco/skill/5ef0c719-5bcb-49f8-b8eb-824388225333, http://data.europa.eu/esco/skill/71c2f41e-14de-4b23-82ad-5dbcd54ba5b0, http://data.europa.eu/esco/skill/978db6a1-7297-4c89-819a-47605f2c3ba8, http://data.europa.eu/esco/skill/ae4f0cc6-e0b9-47f5-bdca-2fc2e6316dce, http://data.europa.eu/esco/skill/cd5efa8c-e44d-4cbc-91c6-796018dbed68, http://data.europa.eu/esco/skill/dc72ad0a-c5dc-4abd-bc0d-ca43e82162e1, http://data.europa.eu/esco/skill/e54ff029-1ce9-447d-a5b2-eb7283a23e6e, http://data.europa.eu/esco/skill/ed8de897-adbe-4f0e-b4d2-534953e64c72, http://data.europa.eu/esco/skill/0d168770-4d9c-4096-b048-a6577818d306, http://data.europa.eu/esco/skill/2180bd8c-86de-4889-8165-adac902eee9d, http://data.europa.eu/esco/skill/21d2f96d-35f7-4e3f-9745-c533d2dd6e97, http://data.europa.eu/esco/skill/2f04bb71-d476-43b3-a60b-5df1d05f5681, http://data.europa.eu/esco/skill/49f85a99-086c-45b6-a6fa-eb90305af7b1, http://data.europa.eu/esco/skill/55c16653-343c-4d02-a9de-7d8e864a4592, http://data.europa.eu/esco/skill/6417a4cc-6f61-4459-a114-761a7fa0279d, http://data.europa.eu/esco/skill/69f0167e-75d9-46cf-847f-72a592880ebb, http://data.europa.eu/esco/skill/6b3afb82-c4ea-4f14-be54-a757fb762663, http://data.europa.eu/esco/skill/925463a7-d51f-4d5b-9f79-4d28cf30acde, http://data.europa.eu/esco/skill/9bb7a97a-1a16-431e-8ea6-ad0f9f59aa0a, http://data.europa.eu/esco/skill/c7451027-8249-405a-bb1b-342ff0f3fb3b, http://data.europa.eu/esco/skill/f47a1998-0beb-43be-9f46-380aa4d183da, http://data.europa.eu/esco/skill/020918ef-4b55-47c1-8430-ab7b8f6a7377, http://data.europa.eu/esco/skill/11430d93-c835-48ed-8e70-285fa69c9ae6, http://data.europa.eu/esco/skill/172020d1-e151-445b-8173-e2a5fb16fe51, http://data.europa.eu/esco/skill/7961413f-61d0-4722-9cd9-20a050a29899, http://data.europa.eu/esco/skill/d12e9d68-84c5-444e-aa98-d36533bf03f6, http://data.europa.eu/esco/skill/ff25cbf0-6978-4c4c-887e-d4b185410d74",2519,"python, bash, aws, google cloud, microsoft azure, devops, ci/cd, continuous integration, continuous deployment, jenkins, github actions, gitlab ci, travis ci, circleci, docker, kubernetes, containerization, helm, terraform, ansible, chef, puppet, linux, unix, git, github, gitlab, system design"
http://data.europa.eu/esco/occupation/3d190639-90f8-4402-b1b3-a104a17e0d67,database integrator,"information structure, domain name service, ICT debugging tools, resource description framework query language, query languages, data extraction, transformation and loading tools, database management systems, use interface description language, integrate ICT data, perform data cleansing, create database diagrams, manage ICT legacy implication, balance database resources, manage data, execute integration testing, verify formal ICT specifications, implement data warehousing techniques, systems development life-cycle, Informatica PowerCenter, business intelligence, IBM InfoSphere DataStage, MDX, Oracle Warehouse Builder, digital systems, Oracle Data Integrator, DB2, Microsoft Access, XQuery, Pentaho Data Integration, database, OpenEdge Database, inter-organisational middleware system, data engineering, ObjectStore, MySQL, TripleStore, SPARQL, SQL Server Integration Services, IBM InfoSphere Information Server, IBM Informix, QlikView Expressor, LDAP, PostgreSQL, Filemaker (database management systems), SQL Server, CA Datacom/DB, LINQ, systems theory, Teradata Database, Oracle Relational Database, SAS Data Management, MarkLogic, N1QL, SAP Data Services, system design, create solutions to problems, perform data mining, define data quality criteria, use scripting programming, write database documentation, execute ICT audits, define integration strategy, design application interfaces, apply ICT systems theory, perform project management, manage cloud data and storage, manage ICT semantic integration","essential, optional","knowledge, skill/competence","http://data.europa.eu/esco/skill/03ff0d53-573a-47a0-a0ad-1995815a4339, http://data.europa.eu/esco/skill/071233c4-ad2b-4f50-b79f-768d2231163e, http://data.europa.eu/esco/skill/6014921e-1d25-4039-adc2-04852d61880e, http://data.europa.eu/esco/skill/99207709-d076-4cce-ba38-e90d3bb28806, http://data.europa.eu/esco/skill/9cf681c7-89ec-470c-b651-7fe03786f586, http://data.europa.eu/esco/skill/9d0d89be-bffa-4393-b6f6-8d05bea49051, http://data.europa.eu/esco/skill/ab1e97ed-2319-4293-a8b7-072d2648822f, http://data.europa.eu/esco/skill/0a30e5a8-60a8-4fda-9f89-8e9cee38da5a, http://data.europa.eu/esco/skill/46ec0033-3c71-415e-bcff-b065675ba2dc, http://data.europa.eu/esco/skill/50b100ea-74fd-4706-99db-3e4ca55e51b8, http://data.europa.eu/esco/skill/84f58e3d-8669-4d83-8c1d-5dd1e73a654f, http://data.europa.eu/esco/skill/861313ba-3a1a-4d33-842a-1b8e45e2415b, http://data.europa.eu/esco/skill/9ba8fd27-275d-4bad-8c48-f668aa99a578, http://data.europa.eu/esco/skill/9ff9db9d-d14b-426e-83f3-e7449af6c79f, http://data.europa.eu/esco/skill/ea412de3-9d7a-4943-8d8c-c6d3c7495d0e, http://data.europa.eu/esco/skill/ee3b1553-2dc5-434b-8dcf-4ae3a40b3a48, http://data.europa.eu/esco/skill/fd6d2981-3d4a-4ce2-9741-cfc98c5b74bd, http://data.europa.eu/esco/skill/09f2f811-a3fb-4de3-a70f-6420a6935575, http://data.europa.eu/esco/skill/0f00f63f-3ab4-4057-b92f-500584b51757, http://data.europa.eu/esco/skill/143769cb-b61e-47d8-a61e-eedfbec1016c, http://data.europa.eu/esco/skill/14fdac88-6d4a-4e47-9df5-02c6d1e86fdd, http://data.europa.eu/esco/skill/1b7c716e-af95-4cda-a42f-6479c8b139f5, http://data.europa.eu/esco/skill/23900e3d-06fa-424c-a5dc-c0ea42edde1e, http://data.europa.eu/esco/skill/397da142-ab35-48fe-b154-7c38f447adfb, http://data.europa.eu/esco/skill/3af687cb-8c7a-46ea-a730-32dbaed040c6, http://data.europa.eu/esco/skill/3cee858e-79e8-4a4b-b99f-93c7f735d58b, http://data.europa.eu/esco/skill/3d03c40c-1b83-4793-8902-2523f40af59e, http://data.europa.eu/esco/skill/3f4dab51-572b-4e2c-85ef-3b4c3f7094e1, http://data.europa.eu/esco/skill/42c3287f-5e50-4559-a2d1-2000c70e0aab, http://data.europa.eu/esco/skill/43ae58b9-5e56-4524-b45a-b422777a0576, http://data.europa.eu/esco/skill/43ec6db6-33f7-449b-a566-5779a7e8997a, http://data.europa.eu/esco/skill/46e93774-7c6a-4dc5-bae9-be97cc461093, http://data.europa.eu/esco/skill/48db96bf-3314-45c6-bad8-fdb6e20e5639, http://data.europa.eu/esco/skill/4959697d-3a24-4f46-af0c-b752318e6c54, http://data.europa.eu/esco/skill/4da171e5-779c-4983-a76f-91c16751e99f, http://data.europa.eu/esco/skill/4e6d2538-a48e-48a7-8dad-14b067cfcb8b, http://data.europa.eu/esco/skill/5da8018b-ae85-4cde-ad93-0394369018f3, http://data.europa.eu/esco/skill/6f7512ab-d46d-402a-8c30-a8878d7c1f88, http://data.europa.eu/esco/skill/81b082fb-9a00-4660-976a-10c985979100, http://data.europa.eu/esco/skill/84251cb1-babf-4d17-a3cd-baa642c24c8d, http://data.europa.eu/esco/skill/97bdd757-29d4-4126-92a6-07608825aa3b, http://data.europa.eu/esco/skill/a57a54b6-2f2e-43e4-9621-b52f4a63cb08, http://data.europa.eu/esco/skill/a8d07b5a-c1a1-42c6-9d53-db9c7a2ca996, http://data.europa.eu/esco/skill/b8eb2517-37d8-43e6-9856-9c29d5c51fde, http://data.europa.eu/esco/skill/c062bab3-3ea0-4291-9220-a2d8fef4bead, http://data.europa.eu/esco/skill/c5ed451b-ef39-47a3-aee7-8f5be0aa8431, http://data.europa.eu/esco/skill/c7d24594-0c11-4b27-9039-fe0bb903da8e, http://data.europa.eu/esco/skill/cdd8b6b2-2fd9-453c-8d62-8a1dc6efcd49, http://data.europa.eu/esco/skill/d9eaf831-9348-4330-a83e-b7c099cdc8f6, http://data.europa.eu/esco/skill/de9f85ba-e77f-48fd-8c66-f5ebaf32d655, http://data.europa.eu/esco/skill/e5a6e1e0-1b07-4432-83ba-77d593b2cb47, http://data.europa.eu/esco/skill/e819cc1e-09d9-47f2-b418-93972852daef, http://data.europa.eu/esco/skill/f597f772-24d3-4cec-813c-cf5a7027c794, http://data.europa.eu/esco/skill/f8e3425c-fe44-4ffb-bafe-0e20d91dadf4, http://data.europa.eu/esco/skill/fae27053-8924-4bfd-b565-c9fe502044c9, http://data.europa.eu/esco/skill/03b9b491-fc9b-4868-914a-bf7cd47b5041, http://data.europa.eu/esco/skill/4216e465-7baa-4884-a241-54b197bb9278, http://data.europa.eu/esco/skill/54c9c155-9293-4329-8ed2-2e76e8b519d4, http://data.europa.eu/esco/skill/5ef0c719-5bcb-49f8-b8eb-824388225333, http://data.europa.eu/esco/skill/64db87c7-2360-4e20-88d3-d222402e477c, http://data.europa.eu/esco/skill/7e1f9657-ab4e-407c-842f-b846197060e3, http://data.europa.eu/esco/skill/a4a882a1-0263-4dd2-b29a-f0028cac2393, http://data.europa.eu/esco/skill/b0096dc5-2e2d-4bc1-8172-05bf486c3968, http://data.europa.eu/esco/skill/cbe2c304-1e7d-489a-97d9-a7d3e37a9db6, http://data.europa.eu/esco/skill/cd5efa8c-e44d-4cbc-91c6-796018dbed68, http://data.europa.eu/esco/skill/d3286405-49f8-4e8a-8046-a4376b4e7963, http://data.europa.eu/esco/skill/fda917eb-0d6a-4371-8c93-2a10bf950966",2521,"python, bash, sql, mysql, postgresql, oracle, sql server, sqlite, mongodb, cassandra, redis, dynamodb, neo4j, elasticsearch, etl, data pipelines, data warehousing, aws, google cloud, microsoft azure, dynamodb, linux, git"
