occupationUri,occupationLabel,skillLabel,relationType,skillType,skillUri,iscoGroup,mapped_skills
http://data.europa.eu/esco/occupation/0464b062-cea6-4164-b10d-956c61956ae7,ICT security administrator,"ICT safety, ethical hacking principles, ICT network security risks, system backup best practice, internet governance, cyber attack counter-measures, security engineering, organisational resilience, database development tools, quality assurance methodologies, mobile device management, network standards, Internet of Things, operating systems, manage IT security compliances, apply company policies, manage ICT data architecture, perform ICT troubleshooting, attend to ICT systems quality, interpret technical texts, solve ICT system problems, maintain ICT identity management, ensure proper document management, identify ICT system weaknesses, maintain database security, computer forensics, information security strategy, cloud security and compliance, ICT security standards, ICT security legislation, telecom regulations, cyber security, cloud monitoring and reporting, web application security threats, information confidentiality, ICT infrastructure, ICT encryption, assess ICT knowledge, implement ICT security policies, manage database, protect personal data and privacy, respond to incidents in cloud, use scripting programming, store digital data and systems, execute ICT audits, remove computer virus or malware from a computer, execute software tests, implement a virtual private network, manage ICT virtualisation environments, address problems critically, implement anti-virus software, implement cloud security and compliance, perform backups, manage cloud data and storage, build business relationships, lead disaster recovery exercises, train employees, implement a firewall, manage keys for data protection","essential, optional","knowledge, skill/competence","http://data.europa.eu/esco/skill/426ceaba-6867-481c-bb6b-aee3933da7d2, http://data.europa.eu/esco/skill/0ffdb6ac-03b5-4f1c-bfcc-3d9cb874fdf9, http://data.europa.eu/esco/skill/2ddb1226-1117-4eb4-ae65-3a2f5a5a3c80, http://data.europa.eu/esco/skill/47ca0da1-cae5-4395-ae6b-fd97b9ff48d3, http://data.europa.eu/esco/skill/5063a99f-975b-4a7c-85e3-69ecb375b4d3, http://data.europa.eu/esco/skill/5898d99a-62a4-4e10-a2e3-0d815ce44248, http://data.europa.eu/esco/skill/6f1edc19-191f-4ba5-a048-ee69aff05bab, http://data.europa.eu/esco/skill/79f24a62-7718-46e1-9b41-37be0560a5ca, http://data.europa.eu/esco/skill/9ef0f3a0-9ce2-4ef1-a987-0366b5cb2dbe, http://data.europa.eu/esco/skill/c7cc6dc5-d56b-4323-8e5c-47c4022f615f, http://data.europa.eu/esco/skill/cf532795-a1fd-43bd-8407-6e43f877e6e3, http://data.europa.eu/esco/skill/d78dedfc-21d2-45fd-ba05-e56b7a8865e6, http://data.europa.eu/esco/skill/f049d050-12da-4e40-813a-2b5eb6df6b51, http://data.europa.eu/esco/skill/f9a6f35b-01a7-40c9-8b61-b6ee46f97272, http://data.europa.eu/esco/skill/06358891-8424-43c5-891e-d40f226bef40, http://data.europa.eu/esco/skill/0a43729f-2a79-4dae-9faa-95520daae79f, http://data.europa.eu/esco/skill/4d85b881-e490-4b4c-897a-2faa4ef53956, http://data.europa.eu/esco/skill/744442ac-c157-4350-8be0-ce454df4f5c5, http://data.europa.eu/esco/skill/7f0b1a66-ebaf-4c8a-b606-4c1844eb692e, http://data.europa.eu/esco/skill/85c11255-469f-41bd-a6d1-382bc4a87783, http://data.europa.eu/esco/skill/9e06bac6-6b91-48ca-8b7d-c1f48cdecd7c, http://data.europa.eu/esco/skill/ab49f767-296b-47d5-af56-0b4a69515b03, http://data.europa.eu/esco/skill/c241f5a5-e23f-47bf-ad24-d83ea0010166, http://data.europa.eu/esco/skill/dad7e408-162f-46a4-8567-db560e19e2fc, http://data.europa.eu/esco/skill/ec85cc63-4e24-4631-bf92-8789db2605c0, http://data.europa.eu/esco/skill/118a9b27-1c5a-4214-b685-1a4d9e6365ea, http://data.europa.eu/esco/skill/11eebd42-44ab-401d-8a2c-bdb9fc9beb50, http://data.europa.eu/esco/skill/1c2978b8-bb0d-4249-9c23-877571a4dffa, http://data.europa.eu/esco/skill/3ff589b7-68df-4ea5-ae41-b395bdb2378f, http://data.europa.eu/esco/skill/7814e88f-c133-4c3b-b27f-857afa145d42, http://data.europa.eu/esco/skill/7f2afce6-e98b-4bbe-8441-d52b45e28ab8, http://data.europa.eu/esco/skill/8088750d-8388-4170-a76f-48354c469c44, http://data.europa.eu/esco/skill/8efa6a7a-6556-4cb8-908d-59d3b5c58d2f, http://data.europa.eu/esco/skill/902fb91c-3113-4004-9b4f-79aa86b638b7, http://data.europa.eu/esco/skill/a56dec32-05ef-45de-a256-ee6741f356db, http://data.europa.eu/esco/skill/d0c6d77e-cb25-4770-bf77-2073fc5f7523, http://data.europa.eu/esco/skill/d32db06e-bd06-4415-a7ab-1b0ee68caa9a, http://data.europa.eu/esco/skill/0dc7aa1b-b5af-4f4b-81ce-ee22ed8b6926, http://data.europa.eu/esco/skill/14d1e367-3efe-4ec5-86ae-eca48710ee4e, http://data.europa.eu/esco/skill/29fb0fb5-dfc4-4098-ac9b-3a712000f48f, http://data.europa.eu/esco/skill/33a82b83-c838-4889-ae62-fae1317481eb, http://data.europa.eu/esco/skill/440d5784-52a5-4729-8b04-29f978bd896d, http://data.europa.eu/esco/skill/5ef0c719-5bcb-49f8-b8eb-824388225333, http://data.europa.eu/esco/skill/611ed16b-99bf-4840-9cab-f55d1d286e0a, http://data.europa.eu/esco/skill/7e1f9657-ab4e-407c-842f-b846197060e3, http://data.europa.eu/esco/skill/8359bd04-d2cb-4757-af1f-39a921df9efe, http://data.europa.eu/esco/skill/913e7e83-b8f8-4574-b1ca-1b38f3fd974a, http://data.europa.eu/esco/skill/acf0a78c-f4e3-4bd9-a5cc-9cf4791b3b95, http://data.europa.eu/esco/skill/ae4f0cc6-e0b9-47f5-bdca-2fc2e6316dce, http://data.europa.eu/esco/skill/b9f16465-56a9-426b-a047-0f9f1f95ec92, http://data.europa.eu/esco/skill/bb2b4485-2bad-402f-8517-44bf7d9afff4, http://data.europa.eu/esco/skill/c13fb093-5ffb-491a-b8b7-fa2d42a57e2e, http://data.europa.eu/esco/skill/cf3e976d-2c3e-495c-a874-f9e8a66d3b48, http://data.europa.eu/esco/skill/d3286405-49f8-4e8a-8046-a4376b4e7963, http://data.europa.eu/esco/skill/dc72ad0a-c5dc-4abd-bc0d-ca43e82162e1, http://data.europa.eu/esco/skill/ddb65832-91a7-4157-9488-719a0e2ad87b, http://data.europa.eu/esco/skill/e54ff029-1ce9-447d-a5b2-eb7283a23e6e, http://data.europa.eu/esco/skill/e5b5053e-0ef6-4c4e-a3f2-42f955f4322c, http://data.europa.eu/esco/skill/e5beeff8-7c98-490a-ae2c-16fbb6a87305",2529,"python, bash, powershell, linux, git, cybersecurity, penetration testing, ethical hacking, vulnerability assessment, network security, cryptography, security auditing, tcp/ip, dns, http, https, vpn, firewalls"
http://data.europa.eu/esco/occupation/04ba4d6c-957d-417f-bf63-5b9e015a9f86,software analyst,"business requirements techniques, software architecture models, software design methodologies, legal requirements of ICT products, ICT system user requirements, data models, translate requirements into visual design, create software design, analyse business processes, develop documentation in accordance with legal requirements, develop software prototype, manage ICT legacy implication, design information system, interact with users to gather requirements, execute feasibility study, define technical requirements, identify ICT user needs, define software architecture, create data models, Haskell, incremental development, Erlang, SAS language, Agile project management, Ruby (computer programming), Common Lisp, Lisp, Visual Basic, Java (computer programming), MDX, computer programming, Prolog (computer programming), OpenEdge Advanced Business Language, iterative development, JavaScript, XQuery, Perl, Smalltalk (computer programming), PHP, inter-organisational middleware system, Assembly (computer programming), Spiral development, C#, R, Groovy, ASP.NET, APL, object-oriented modelling, SPARQL, Outsourcing model, hybrid model, Waterfall development, unified modelling language, service-oriented modelling, core banking software, levels of software testing, TypeScript, ICT project management, Rapid application development, resource description framework query language, CoffeeScript, Objective-C, query languages, ICT problem management techniques, ML (computer programming), LDAP, SPARK, Open source model, AJAX, C++, trading software, SAP R3, Swift (computer programming), ICT project management methodologies, MATLAB, LINQ, Python (computer programming), Scratch (computer programming), Process-based management, lean project management, Agile development, VBScript, COBOL, Pascal (computer programming), ABAP, Prototyping development, DevOps, N1QL, Scala, use an application-specific interface, create prototype of user experience solutions, ensure compliance with legal requirements, create project specifications, provide ICT consulting advice, manage ICT project, ensure compliance with company regulations, analyse ICT system, monitor system performance, solve ICT system problems, manage system testing, identify ICT system weaknesses","essential, optional","knowledge, skill/competence","http://data.europa.eu/esco/skill/0ee94c0a-3716-494a-95a2-dcbab9e58be2, http://data.europa.eu/esco/skill/2450c3b3-e78e-435b-b84d-e05d984e71dc, http://data.europa.eu/esco/skill/8ff015a0-98ea-4d80-a23e-1f68110a919e, http://data.europa.eu/esco/skill/a846cb9e-c152-41e7-bd34-45e7ff941e3b, http://data.europa.eu/esco/skill/ca73ac82-867a-4afa-9732-834aebe896ff, http://data.europa.eu/esco/skill/fecf8a0d-62c4-4e71-9b03-0f4fc2ad7bf5, http://data.europa.eu/esco/skill/2d6d4784-0992-48e7-b100-22d7229b3f0a, http://data.europa.eu/esco/skill/3bddfd7c-ab6d-40c2-883d-5e97fb7640ba, http://data.europa.eu/esco/skill/56042303-972b-41be-9310-58467599ff7e, http://data.europa.eu/esco/skill/695c3249-18e7-4435-bdb8-54a16011159d, http://data.europa.eu/esco/skill/797a4416-0b8d-44f3-8fcd-eb10bd0be6b4, http://data.europa.eu/esco/skill/861313ba-3a1a-4d33-842a-1b8e45e2415b, http://data.europa.eu/esco/skill/a47d194d-0ffd-4aaa-b695-fbbe0255000e, http://data.europa.eu/esco/skill/a8797f21-1af0-4c5e-98ca-bf1442929363, http://data.europa.eu/esco/skill/d74df140-eb69-43e2-bac9-1cafc824d702, http://data.europa.eu/esco/skill/d9e5349e-8791-49c2-8ba4-839fdd1606c2, http://data.europa.eu/esco/skill/ddfe79e2-c2e3-4ba7-9bdf-3820b4f75b54, http://data.europa.eu/esco/skill/f7e2eb04-3e50-4561-bce1-7e51a1fec308, http://data.europa.eu/esco/skill/fbafa41f-cd05-4109-a649-8b44d306d779, http://data.europa.eu/esco/skill/000f1d3d-220f-4789-9c0a-cc742521fb02, http://data.europa.eu/esco/skill/00c04e40-35ea-4ed1-824c-82f936c8f876, http://data.europa.eu/esco/skill/034c29fa-c3ba-45ea-b8f3-bf8e3705e386, http://data.europa.eu/esco/skill/04f1b938-d4d4-4cb1-a863-982af76b9d93, http://data.europa.eu/esco/skill/0a9acb6b-1139-4be9-b431-3a80a959f2f4, http://data.europa.eu/esco/skill/0ccdfe98-f845-4598-84a1-3dca66e9d9a3, http://data.europa.eu/esco/skill/0cd6dcf1-5778-42a5-b685-4d01ae4a4871, http://data.europa.eu/esco/skill/0de61385-de6d-4146-ba32-1cc1bc102220, http://data.europa.eu/esco/skill/13bdd41a-2a18-441f-96db-41252c519413, http://data.europa.eu/esco/skill/19a8293b-8e95-4de3-983f-77484079c389, http://data.europa.eu/esco/skill/1b7c716e-af95-4cda-a42f-6479c8b139f5, http://data.europa.eu/esco/skill/21d2f96d-35f7-4e3f-9745-c533d2dd6e97, http://data.europa.eu/esco/skill/2bde42ae-e776-41c1-9ded-b07b30bfe985, http://data.europa.eu/esco/skill/300d432b-f457-4cd3-9cb1-1858c7d14954, http://data.europa.eu/esco/skill/33d49d4f-31ec-473f-9b8a-b555aa5116bb, http://data.europa.eu/esco/skill/3cd569a2-4f88-4c1e-9995-8dce8c5e51a7, http://data.europa.eu/esco/skill/3f4dab51-572b-4e2c-85ef-3b4c3f7094e1, http://data.europa.eu/esco/skill/401eb8d8-6daa-4f8b-90ad-60afc71eb4f8, http://data.europa.eu/esco/skill/42ed3bfb-1a01-4c8b-9758-fc6438865734, http://data.europa.eu/esco/skill/4350c38d-0fe9-4ca7-bab9-40ed7f72b04f, http://data.europa.eu/esco/skill/46e93774-7c6a-4dc5-bae9-be97cc461093, http://data.europa.eu/esco/skill/47b9bbcf-356c-4782-83a4-7f5a1b2b51a3, http://data.europa.eu/esco/skill/4840338b-ac6c-486a-be1d-9ddfe00b8bdf, http://data.europa.eu/esco/skill/4c016b68-4116-468c-9dc6-42710c239e4a, http://data.europa.eu/esco/skill/51586df8-1c46-4b47-8583-773cb63bf00b, http://data.europa.eu/esco/skill/52cf3037-ab53-4806-85ed-7fd21ea7f6a1, http://data.europa.eu/esco/skill/56a7f561-1d55-43c9-9cd7-36a0a9bc6c50, http://data.europa.eu/esco/skill/58d7a289-dafd-4363-833f-d1dc4140885e, http://data.europa.eu/esco/skill/5be3d306-6cf1-4b49-aa1d-01651dd4ba4c, http://data.europa.eu/esco/skill/5da8018b-ae85-4cde-ad93-0394369018f3, http://data.europa.eu/esco/skill/63f0aa84-5e4c-4eb6-8e8c-876d9feedf1f, http://data.europa.eu/esco/skill/67a118f4-8a5f-48f7-8e5f-de34b9ca2c37, http://data.europa.eu/esco/skill/6a876489-7ad8-4a13-b09c-c9b8e97a302e, http://data.europa.eu/esco/skill/7193cb6d-8334-494f-86e5-21e6d03a47c3, http://data.europa.eu/esco/skill/83218cac-3599-417e-93d2-26013cdccd98, http://data.europa.eu/esco/skill/84f583f4-f32a-4202-9b92-e25f0c978410, http://data.europa.eu/esco/skill/85f46538-ae70-498a-bfbc-b8ddafe96c7d, http://data.europa.eu/esco/skill/867137fb-ff1b-4ca3-99f3-cb6969aa2c68, http://data.europa.eu/esco/skill/94dd823c-148e-4614-a6e8-99249b16357d, http://data.europa.eu/esco/skill/96eb286a-58b7-45ff-a916-5578d0b79b8c, http://data.europa.eu/esco/skill/99207709-d076-4cce-ba38-e90d3bb28806, http://data.europa.eu/esco/skill/993b1e23-f2de-4bd8-b33f-f86dde1c8e9d, http://data.europa.eu/esco/skill/9973a5a2-7822-4161-99e9-95c781eb63f8, http://data.europa.eu/esco/skill/9cf681c7-89ec-470c-b651-7fe03786f586, http://data.europa.eu/esco/skill/a3ce2bf7-5562-4639-9b52-fdb4850a3904, http://data.europa.eu/esco/skill/a4d336a6-9ffd-402a-91cc-f359716ba4e0, http://data.europa.eu/esco/skill/a57a54b6-2f2e-43e4-9621-b52f4a63cb08, http://data.europa.eu/esco/skill/af7ae54f-4649-4c16-87c7-59ba41d4d57f, http://data.europa.eu/esco/skill/b16200f4-4f39-4b8b-aa9d-3568054d6bdb, http://data.europa.eu/esco/skill/b4dc6e4f-dc7d-445f-8ce2-d7b9d225e282, http://data.europa.eu/esco/skill/b633eb55-8f1f-4ae6-ab4c-2022ffe2cb7f, http://data.europa.eu/esco/skill/ba1b0441-a6b8-4e57-8ccc-871012f63e42, http://data.europa.eu/esco/skill/bb99af26-71ff-4dca-bde7-1eb1f6194426, http://data.europa.eu/esco/skill/be80acfc-b6f2-4411-9b8d-b19d9cd2556a, http://data.europa.eu/esco/skill/bec4359e-cb92-468f-a997-8fb28e32fba9, http://data.europa.eu/esco/skill/c3a03c5a-c260-4c26-9b9a-873abb396f4d, http://data.europa.eu/esco/skill/c7d24594-0c11-4b27-9039-fe0bb903da8e, http://data.europa.eu/esco/skill/ccd0a1d9-afda-43d9-b901-96344886e14d, http://data.europa.eu/esco/skill/d56fc2b5-4b0a-4e7e-9bde-a33736f6ff18, http://data.europa.eu/esco/skill/d5a59ca8-2e91-472e-8571-d12ce4478679, http://data.europa.eu/esco/skill/da6393d5-a53c-4863-abc7-51f36281d74e, http://data.europa.eu/esco/skill/dba46f87-0831-49cd-a1c7-340a653c0221, http://data.europa.eu/esco/skill/dcdd5ddf-82a6-4ac3-8edc-d4b23cae9a88, http://data.europa.eu/esco/skill/def007fa-5fed-4a5f-91a2-b0d7e3db1be1, http://data.europa.eu/esco/skill/e8b89eb6-51e8-4c3a-babb-88b2e110376b, http://data.europa.eu/esco/skill/eb0e5615-1575-4a86-a1a2-7d39595033c5, http://data.europa.eu/esco/skill/ed1d8bd4-cd2a-4c64-b665-56d70651026c, http://data.europa.eu/esco/skill/f0de4973-0a70-4644-8fd4-3a97080476f4, http://data.europa.eu/esco/skill/f597f772-24d3-4cec-813c-cf5a7027c794, http://data.europa.eu/esco/skill/ffddfc7c-a9dd-449f-9e96-882dc447c8b6, http://data.europa.eu/esco/skill/04fe962b-4017-4eb7-9139-7d69b6922bc9, http://data.europa.eu/esco/skill/07dd856d-6141-48a7-a228-918f88494812, http://data.europa.eu/esco/skill/1dae8445-12e5-423a-bb26-824010e299b9, http://data.europa.eu/esco/skill/21fecc8a-392e-49ce-ac26-fb0696ccfead, http://data.europa.eu/esco/skill/283cbcd3-7101-4dbb-be37-56f3625515b1, http://data.europa.eu/esco/skill/3c76296d-4bbd-44ba-8eaa-95bf275f79b7, http://data.europa.eu/esco/skill/4cb51222-3e2e-417c-9a5c-e9ccf262721d, http://data.europa.eu/esco/skill/7adb8473-bcc6-4ff8-9850-76d945d40092, http://data.europa.eu/esco/skill/9190d87f-9792-42e0-bb7f-64294a656bcd, http://data.europa.eu/esco/skill/9e06bac6-6b91-48ca-8b7d-c1f48cdecd7c, http://data.europa.eu/esco/skill/ce354460-500e-4eaa-8e95-8f243fcea3db, http://data.europa.eu/esco/skill/dad7e408-162f-46a4-8567-db560e19e2fc",2512,"python, java, c, c++, c#, javascript, typescript, go, rust, kotlin, php, ruby, scala, bash, json, rest api, sql, docker, kubernetes, linux, git, github, unit testing, integration testing, test automation, junit, pytest, object oriented programming, design patterns, microservices, distributed systems, system design, agile, scrum, kanban"
http://data.europa.eu/esco/occupation/061f56c6-36eb-4aa7-b5ef-98b7a569da1c,performance video operator,"draw up artistic production, work ergonomically, understand artistic concepts, safeguard artistic quality of performance, run a media server, perform quality control of design during a run, communicate during show, adapt artistic plan to location, attend rehearsals, work safely with machines, use personal protection equipment, adapt to artists' creative demands, prevent fire in a performance environment, prepare personal work environment, intervene with actions on stage, use communication equipment, translate artistic concepts to technical designs, work safely with chemicals, support a designer in the developing process, organise resources for artistic production, edit digital moving images, adjust projector, work safely with mobile electrical systems under supervision, work with respect for own safety, interpret artistic intentions, consult with stakeholders on implementation of a production, use technical documentation, plan audiovisual recording, set up projection equipment, keep up with trends, set up equipment in a timely manner, follow safety procedures when working at heights, monitor developments in technology used for design, operate a camera, manage technical resources stock, run a projection, lead a team, provide technical documentation, assess power needs, ensure safety of mobile electrical systems, update design results during rehearsals, update budget, set up cameras, pack electronic equipment, de-rig electronic equipment, maintain audiovisual equipment, manage teamwork, assemble performance equipment, advise client on technical possibilities, use a telecine, coach staff for running the performance, keep personal administration, manage personal professional development, assist multimedia operator, mix live images, develop professional network, adapt existing designs to changed circumstances, document your own practice, maintain system layout for a production, store performance equipment, instruct on set up of equipment","essential, optional",skill/competence,"http://data.europa.eu/esco/skill/02c7caf4-4e8b-4745-8917-dbbd3af17c28, http://data.europa.eu/esco/skill/156f8c5b-894a-4ccc-a70e-37a2726f3f00, http://data.europa.eu/esco/skill/1633770e-5606-4422-b293-6c8c551fe663, http://data.europa.eu/esco/skill/1e8751e3-9b7a-4230-a6e5-83bf57fb70b6, http://data.europa.eu/esco/skill/398b4b25-fb61-4003-9293-50914d8bfcba, http://data.europa.eu/esco/skill/3a1c546d-914a-46e4-a7c1-47d43646fedd, http://data.europa.eu/esco/skill/4039158b-2e58-484a-8771-ad215e065c12, http://data.europa.eu/esco/skill/409b165c-ddae-4366-aeac-fa95c79e57a9, http://data.europa.eu/esco/skill/4b973dcf-3ffc-4c70-b84a-8360e63db7cd, http://data.europa.eu/esco/skill/4c831013-9027-4ec6-83de-c5c19e68d083, http://data.europa.eu/esco/skill/51754b8a-3e2c-4cc1-86e6-cf510d9c6fe4, http://data.europa.eu/esco/skill/591dd514-735b-46e4-a28d-3a4c42f49b72, http://data.europa.eu/esco/skill/5f08605b-aa03-45ed-bc49-395477783a38, http://data.europa.eu/esco/skill/66509193-f1ce-44a6-8c4e-db24dcd19cdd, http://data.europa.eu/esco/skill/66b95837-7ad1-4acd-b2a0-fdf2e55323c4, http://data.europa.eu/esco/skill/7373abdb-ee5a-4949-b4ae-dee60ab37914, http://data.europa.eu/esco/skill/88de5ff4-310a-4f4f-9b47-349eb5589902, http://data.europa.eu/esco/skill/89d2bb53-67fc-4b9e-80c7-07b6c587bc0d, http://data.europa.eu/esco/skill/8a99780c-5345-4783-8ee8-97dabb9401ab, http://data.europa.eu/esco/skill/9b6a88df-d64d-4c06-ad01-dc23dc92632d, http://data.europa.eu/esco/skill/9ce52938-fe28-4548-b38d-0c783933e19a, http://data.europa.eu/esco/skill/a6d2edbd-5f87-40e0-a227-b7ae8c08db03, http://data.europa.eu/esco/skill/b69cb255-e939-4928-b3fd-9557087dce52, http://data.europa.eu/esco/skill/b73035a9-bf06-412c-9796-db579f85995c, http://data.europa.eu/esco/skill/bf449d96-2ce7-4095-8d14-84bfa4c0fa19, http://data.europa.eu/esco/skill/c3e88160-eebc-4cb9-aacb-c11792bcdc7a, http://data.europa.eu/esco/skill/cffc3e97-e942-4b13-a2f3-0bf4910c06d3, http://data.europa.eu/esco/skill/e07a0fbf-7ffe-47d0-9636-e25cbb5fd475, http://data.europa.eu/esco/skill/e2c884e4-4952-4a5c-ba69-ad406b66bd7d, http://data.europa.eu/esco/skill/efda73b4-5212-40a7-b2f8-d2f754ffdf2b, http://data.europa.eu/esco/skill/f32eb5de-3fc7-4bba-853a-c6f2f043c33e, http://data.europa.eu/esco/skill/fafbb75f-ec35-4cc2-996a-20c85ef6c266, http://data.europa.eu/esco/skill/0d90f823-6f6a-44df-8ab0-1771300d9660, http://data.europa.eu/esco/skill/10cade4f-df4d-4408-8924-5994976fc798, http://data.europa.eu/esco/skill/130f6043-6bb4-4f14-81b3-b34cdaf6ea1f, http://data.europa.eu/esco/skill/1c685542-aa09-4704-ba87-2b1ffd802e1f, http://data.europa.eu/esco/skill/1f1d2ff8-c4c1-45cc-9812-6a7ee84a73cb, http://data.europa.eu/esco/skill/2636b3d3-843e-46a9-8b4c-a9d6ca3f5a2d, http://data.europa.eu/esco/skill/36fccad9-1d20-4104-bcc2-a8ea9d1ce5ea, http://data.europa.eu/esco/skill/39f55791-434d-4169-9a46-c000a2859a66, http://data.europa.eu/esco/skill/43f0bfbb-8cda-4e31-8dcc-9ea479aae08c, http://data.europa.eu/esco/skill/4ce09e3d-ca6b-424a-a328-7f551db75e59, http://data.europa.eu/esco/skill/4e039fe9-e7d3-4d9b-82e5-381269a38ceb, http://data.europa.eu/esco/skill/57d4d1f4-28b2-4a38-b7a9-a80626e99afc, http://data.europa.eu/esco/skill/60d97332-5284-47f9-a5ff-5e73c10806a0, http://data.europa.eu/esco/skill/6e4f264a-e2e1-42fb-9866-e64069f8b441, http://data.europa.eu/esco/skill/75e48971-3242-4ea5-a1ba-4deec48ad41c, http://data.europa.eu/esco/skill/79edf815-70bf-48fc-a2f4-86ae5d372918, http://data.europa.eu/esco/skill/7b3abd38-61ae-42a4-88bb-0884784f9ee1, http://data.europa.eu/esco/skill/8a16ada9-2794-4c81-bb48-5ec1cfbcf1db, http://data.europa.eu/esco/skill/91a58da7-2111-4a03-9874-37311e105d06, http://data.europa.eu/esco/skill/9df34bc3-25d4-4452-a896-4d19b94ef896, http://data.europa.eu/esco/skill/a8d24a95-47b3-4f88-92e7-06600bcd3612, http://data.europa.eu/esco/skill/af8ca5cf-7fd1-4275-a886-e951c335d497, http://data.europa.eu/esco/skill/bb979b3b-8292-409f-8c27-b17e13bab8bb, http://data.europa.eu/esco/skill/bf5d77ad-e18c-48d8-83f0-bc79c011c74a, http://data.europa.eu/esco/skill/c0733631-0c5e-4b5c-a291-aad52ca493ce, http://data.europa.eu/esco/skill/cdf83a12-56d4-4e3c-ad0b-af1c1f21c62a, http://data.europa.eu/esco/skill/dd009c14-f702-4d16-a919-8d2098205cf4, http://data.europa.eu/esco/skill/eca40476-bf90-44fd-b318-c609ab083bc4, http://data.europa.eu/esco/skill/fbb14862-aa9c-4f60-bf33-8b27a0785aba",3521,"python, bash, linux, git"
