occupationUri,occupationLabel,skillLabel,relationType,skillType,skillUri,iscoGroup,mapped_skills
http://data.europa.eu/esco/occupation/e0b544dd-b621-4126-a55e-054af25c6ea0,ICT network architect,"network engineering, ICT network routing, ICT network security risks, ICT security legislation, business process modelling, network standards, ICT networking hardware, system design, use an application-specific interface, assess ICT knowledge, identify suppliers, implement ICT security policies, maintain information network hardware, design computer network, design process, design ICT hardware placement, use back-up and recovery tools, develop creative ideas, forecast future ICT network needs, implement a virtual private network, analyse business requirements, adjust ICT system capacity, maintain internet protocol configuration, define ICT network design policies, implement ICT network diagnostic tools, define technical requirements, analyse network bandwidth requirements, implement a firewall, Agile project management, network management system tools, procurement of ICT network equipment, ICT security standards, attack vectors, internet governance, Cisco, organisational resilience, legal requirements of ICT products, ICT project management methodologies, Process-based management, lean project management, ICT network simulation, design cloud architecture, manage staff, protect personal data and privacy, provide cost benefit analysis reports, design cloud networks, develop with cloud services, perform ICT troubleshooting, implement spam protection, apply technical communication skills, automate cloud tasks, build business relationships, design for organisational complexity, monitor communication channels' performance, perform resource planning","essential, optional","knowledge, skill/competence","http://data.europa.eu/esco/skill/02058de6-4b98-449f-8a45-8588b0eb2446, http://data.europa.eu/esco/skill/0da6cab1-0ee9-4391-a299-f71fbf21db56, http://data.europa.eu/esco/skill/2ddb1226-1117-4eb4-ae65-3a2f5a5a3c80, http://data.europa.eu/esco/skill/7814e88f-c133-4c3b-b27f-857afa145d42, http://data.europa.eu/esco/skill/98301d4a-2cc3-439d-8d7f-0b6ac76302bb, http://data.europa.eu/esco/skill/d78dedfc-21d2-45fd-ba05-e56b7a8865e6, http://data.europa.eu/esco/skill/f9e788df-d68a-4f92-92c7-80e135fc35ff, http://data.europa.eu/esco/skill/fae27053-8924-4bfd-b565-c9fe502044c9, http://data.europa.eu/esco/skill/04fe962b-4017-4eb7-9139-7d69b6922bc9, http://data.europa.eu/esco/skill/0dc7aa1b-b5af-4f4b-81ce-ee22ed8b6926, http://data.europa.eu/esco/skill/11747665-0e98-4f27-bd0d-536862cd5746, http://data.europa.eu/esco/skill/14d1e367-3efe-4ec5-86ae-eca48710ee4e, http://data.europa.eu/esco/skill/19c0e68e-6e6c-4698-85dc-ef66a9de2c37, http://data.europa.eu/esco/skill/2164e860-7f20-48bc-b98c-5d9f8a561550, http://data.europa.eu/esco/skill/2c28fc20-8a60-4311-8899-5ef8729c05b3, http://data.europa.eu/esco/skill/3fb8b724-1d52-4d11-b8b8-1776f558d1f0, http://data.europa.eu/esco/skill/82de2df7-0d6c-42b1-94ac-b3e9a029e917, http://data.europa.eu/esco/skill/8c4c49d4-9708-433f-8ca7-bf2c5211ee49, http://data.europa.eu/esco/skill/8fa840f7-e66a-4370-8e6d-7d554260c31c, http://data.europa.eu/esco/skill/acf0a78c-f4e3-4bd9-a5cc-9cf4791b3b95, http://data.europa.eu/esco/skill/b04f377b-ee80-4b38-aca1-19d266a23b17, http://data.europa.eu/esco/skill/b1604a2d-c26a-427d-bda9-b8073a319fe9, http://data.europa.eu/esco/skill/b9aad733-959a-4178-984f-53e4bd05b420, http://data.europa.eu/esco/skill/bb562019-5222-45db-a16c-730edbb1d27c, http://data.europa.eu/esco/skill/bf7ea00f-db77-4a95-9b9f-2d12b6d9fcb4, http://data.europa.eu/esco/skill/d9e5349e-8791-49c2-8ba4-839fdd1606c2, http://data.europa.eu/esco/skill/da042121-959d-451b-b4d0-3bbf07c1bc67, http://data.europa.eu/esco/skill/e5b5053e-0ef6-4c4e-a3f2-42f955f4322c, http://data.europa.eu/esco/skill/0a9acb6b-1139-4be9-b431-3a80a959f2f4, http://data.europa.eu/esco/skill/0ab03c6c-281b-48f4-83e0-10eeb27a1bae, http://data.europa.eu/esco/skill/32428b21-514b-42c2-81b5-244a7804ea74, http://data.europa.eu/esco/skill/3ff589b7-68df-4ea5-ae41-b395bdb2378f, http://data.europa.eu/esco/skill/501537a7-9d63-491d-ae02-09f04767ff1e, http://data.europa.eu/esco/skill/5063a99f-975b-4a7c-85e3-69ecb375b4d3, http://data.europa.eu/esco/skill/709ef32a-7435-48e2-8fa2-16e389ecab8a, http://data.europa.eu/esco/skill/79f24a62-7718-46e1-9b41-37be0560a5ca, http://data.europa.eu/esco/skill/a846cb9e-c152-41e7-bd34-45e7ff941e3b, http://data.europa.eu/esco/skill/bec4359e-cb92-468f-a997-8fb28e32fba9, http://data.europa.eu/esco/skill/d5a59ca8-2e91-472e-8571-d12ce4478679, http://data.europa.eu/esco/skill/da6393d5-a53c-4863-abc7-51f36281d74e, http://data.europa.eu/esco/skill/f6424ebb-8401-446b-9f7e-10d7c854da02, http://data.europa.eu/esco/skill/11430d93-c835-48ed-8e70-285fa69c9ae6, http://data.europa.eu/esco/skill/339ac029-066a-4985-9f9d-b3d7c8fea0bb, http://data.europa.eu/esco/skill/33a82b83-c838-4889-ae62-fae1317481eb, http://data.europa.eu/esco/skill/48b68726-0fd6-4e03-a5eb-82236516ee7a, http://data.europa.eu/esco/skill/4da4587a-fd0b-4ca2-886c-c42a1562d432, http://data.europa.eu/esco/skill/6b643893-0a1f-4f6c-83a1-e7eef75849b9, http://data.europa.eu/esco/skill/744442ac-c157-4350-8be0-ce454df4f5c5, http://data.europa.eu/esco/skill/c2cbbccf-4ffd-4626-86e7-505b39c872a0, http://data.europa.eu/esco/skill/c32ad607-0c4d-4e34-b73f-668298f7bf13, http://data.europa.eu/esco/skill/ce8ae6ca-61d8-4174-b457-641de96cbff4, http://data.europa.eu/esco/skill/dc72ad0a-c5dc-4abd-bc0d-ca43e82162e1, http://data.europa.eu/esco/skill/dfff95c6-9758-4c04-a228-7eaa88dec6cd, http://data.europa.eu/esco/skill/e08821b5-d6dd-4db9-a0f1-43185653c244, http://data.europa.eu/esco/skill/f5dd06b8-5d17-4932-9d03-957d0c4f5051",2523,"python, bash, aws, docker, kubernetes, linux, unix, windows server, network security, tcp/ip, dns, http, https, vpn, firewalls, load balancing"
http://data.europa.eu/esco/occupation/e1c72b5f-4c5c-487c-a6df-e84b64a51dae,ICT system architect,"systems development life-cycle, hardware platforms, digital systems, web programming, business process modelling, database development tools, systems theory, system design, use an application-specific interface, use markup languages, assess ICT knowledge, implement ICT security policies, align software with system architectures, manage database, acquire system component, design information system, analyse business requirements, apply ICT systems theory, manage system testing, define technical requirements, integrate system components, design enterprise architecture, create data models, Haskell, Erlang, information structure, SAS language, Agile project management, Ruby (computer programming), Common Lisp, Lisp, Visual Basic, defence standard procedures, Java (computer programming), computer programming, model based system engineering, Prolog (computer programming), OpenEdge Advanced Business Language, JavaScript, Perl, Smalltalk (computer programming), PHP, image recognition, Assembly (computer programming), C#, R, Groovy, ASP.NET, APL, security engineering, ICT system integration, Oracle WebLogic, task algorithmisation, ICT security legislation, Microsoft Visual C++, TypeScript, CoffeeScript, Objective-C, ML (computer programming), ICT system programming, AJAX, C++, SAP R3, Swift (computer programming), ICT project management methodologies, MATLAB, Python (computer programming), Scratch (computer programming), Process-based management, lean project management, VBScript, COBOL, Pascal (computer programming), ABAP, ICT process quality models, Scala, plan migration to cloud, design cloud architecture, design process, manage staff, provide cost benefit analysis reports, use object-oriented programming, develop with cloud services, design database scheme, design database in the cloud, solve ICT system problems, apply technical communication skills, manage standards for data exchange, manage cloud data and storage, build business relationships, design for organisational complexity, perform resource planning","essential, optional","knowledge, skill/competence","http://data.europa.eu/esco/skill/09f2f811-a3fb-4de3-a70f-6420a6935575, http://data.europa.eu/esco/skill/117373c8-f04b-4fff-8683-aebe36edac81, http://data.europa.eu/esco/skill/397da142-ab35-48fe-b154-7c38f447adfb, http://data.europa.eu/esco/skill/69bbd53f-fbb0-4476-b4b2-ef7844464e28, http://data.europa.eu/esco/skill/98301d4a-2cc3-439d-8d7f-0b6ac76302bb, http://data.europa.eu/esco/skill/9ef0f3a0-9ce2-4ef1-a987-0366b5cb2dbe, http://data.europa.eu/esco/skill/cdd8b6b2-2fd9-453c-8d62-8a1dc6efcd49, http://data.europa.eu/esco/skill/fae27053-8924-4bfd-b565-c9fe502044c9, http://data.europa.eu/esco/skill/04fe962b-4017-4eb7-9139-7d69b6922bc9, http://data.europa.eu/esco/skill/0af062de-eb43-41e9-9b96-249e2cd22d26, http://data.europa.eu/esco/skill/0dc7aa1b-b5af-4f4b-81ce-ee22ed8b6926, http://data.europa.eu/esco/skill/14d1e367-3efe-4ec5-86ae-eca48710ee4e, http://data.europa.eu/esco/skill/2857540c-180b-4208-9127-e94a01871966, http://data.europa.eu/esco/skill/29fb0fb5-dfc4-4098-ac9b-3a712000f48f, http://data.europa.eu/esco/skill/90be83d9-56f1-46a4-a6bc-96c51f6c9025, http://data.europa.eu/esco/skill/a47d194d-0ffd-4aaa-b695-fbbe0255000e, http://data.europa.eu/esco/skill/b04f377b-ee80-4b38-aca1-19d266a23b17, http://data.europa.eu/esco/skill/cbe2c304-1e7d-489a-97d9-a7d3e37a9db6, http://data.europa.eu/esco/skill/ce354460-500e-4eaa-8e95-8f243fcea3db, http://data.europa.eu/esco/skill/d9e5349e-8791-49c2-8ba4-839fdd1606c2, http://data.europa.eu/esco/skill/ed8de897-adbe-4f0e-b4d2-534953e64c72, http://data.europa.eu/esco/skill/ee3c1d54-f46a-43c7-a0f9-0ba3648164d0, http://data.europa.eu/esco/skill/fbafa41f-cd05-4109-a649-8b44d306d779, http://data.europa.eu/esco/skill/000f1d3d-220f-4789-9c0a-cc742521fb02, http://data.europa.eu/esco/skill/034c29fa-c3ba-45ea-b8f3-bf8e3705e386, http://data.europa.eu/esco/skill/03ff0d53-573a-47a0-a0ad-1995815a4339, http://data.europa.eu/esco/skill/04f1b938-d4d4-4cb1-a863-982af76b9d93, http://data.europa.eu/esco/skill/0a9acb6b-1139-4be9-b431-3a80a959f2f4, http://data.europa.eu/esco/skill/0ccdfe98-f845-4598-84a1-3dca66e9d9a3, http://data.europa.eu/esco/skill/0cd6dcf1-5778-42a5-b685-4d01ae4a4871, http://data.europa.eu/esco/skill/0de61385-de6d-4146-ba32-1cc1bc102220, http://data.europa.eu/esco/skill/13bdd41a-2a18-441f-96db-41252c519413, http://data.europa.eu/esco/skill/17924c75-45f4-4593-afac-eea0d51f04b5, http://data.europa.eu/esco/skill/19a8293b-8e95-4de3-983f-77484079c389, http://data.europa.eu/esco/skill/21d2f96d-35f7-4e3f-9745-c533d2dd6e97, http://data.europa.eu/esco/skill/25df422a-bf0a-4f76-8631-d0be91cb8751, http://data.europa.eu/esco/skill/2bde42ae-e776-41c1-9ded-b07b30bfe985, http://data.europa.eu/esco/skill/300d432b-f457-4cd3-9cb1-1858c7d14954, http://data.europa.eu/esco/skill/3cd569a2-4f88-4c1e-9995-8dce8c5e51a7, http://data.europa.eu/esco/skill/401eb8d8-6daa-4f8b-90ad-60afc71eb4f8, http://data.europa.eu/esco/skill/42ed3bfb-1a01-4c8b-9758-fc6438865734, http://data.europa.eu/esco/skill/4350c38d-0fe9-4ca7-bab9-40ed7f72b04f, http://data.europa.eu/esco/skill/45f1ae17-c20d-40fc-9307-7d33b6ca9213, http://data.europa.eu/esco/skill/47b9bbcf-356c-4782-83a4-7f5a1b2b51a3, http://data.europa.eu/esco/skill/4c016b68-4116-468c-9dc6-42710c239e4a, http://data.europa.eu/esco/skill/51586df8-1c46-4b47-8583-773cb63bf00b, http://data.europa.eu/esco/skill/52cf3037-ab53-4806-85ed-7fd21ea7f6a1, http://data.europa.eu/esco/skill/56a7f561-1d55-43c9-9cd7-36a0a9bc6c50, http://data.europa.eu/esco/skill/58d7a289-dafd-4363-833f-d1dc4140885e, http://data.europa.eu/esco/skill/6f1edc19-191f-4ba5-a048-ee69aff05bab, http://data.europa.eu/esco/skill/6fa1c2c0-a012-4ca0-9642-e01569ba322c, http://data.europa.eu/esco/skill/70de94f5-9575-4edd-bca7-c797b023b9d6, http://data.europa.eu/esco/skill/7482a123-e801-48de-9733-262125671410, http://data.europa.eu/esco/skill/7814e88f-c133-4c3b-b27f-857afa145d42, http://data.europa.eu/esco/skill/8369ede5-4200-4a44-be2e-bc60ef959259, http://data.europa.eu/esco/skill/867137fb-ff1b-4ca3-99f3-cb6969aa2c68, http://data.europa.eu/esco/skill/993b1e23-f2de-4bd8-b33f-f86dde1c8e9d, http://data.europa.eu/esco/skill/9973a5a2-7822-4161-99e9-95c781eb63f8, http://data.europa.eu/esco/skill/a4d336a6-9ffd-402a-91cc-f359716ba4e0, http://data.europa.eu/esco/skill/b105ec9b-0857-41d6-8d07-a83e58b73d90, http://data.europa.eu/esco/skill/b4dc6e4f-dc7d-445f-8ce2-d7b9d225e282, http://data.europa.eu/esco/skill/b633eb55-8f1f-4ae6-ab4c-2022ffe2cb7f, http://data.europa.eu/esco/skill/bb99af26-71ff-4dca-bde7-1eb1f6194426, http://data.europa.eu/esco/skill/be80acfc-b6f2-4411-9b8d-b19d9cd2556a, http://data.europa.eu/esco/skill/bec4359e-cb92-468f-a997-8fb28e32fba9, http://data.europa.eu/esco/skill/c3a03c5a-c260-4c26-9b9a-873abb396f4d, http://data.europa.eu/esco/skill/ccd0a1d9-afda-43d9-b901-96344886e14d, http://data.europa.eu/esco/skill/d56fc2b5-4b0a-4e7e-9bde-a33736f6ff18, http://data.europa.eu/esco/skill/d5a59ca8-2e91-472e-8571-d12ce4478679, http://data.europa.eu/esco/skill/da6393d5-a53c-4863-abc7-51f36281d74e, http://data.europa.eu/esco/skill/dcdd5ddf-82a6-4ac3-8edc-d4b23cae9a88, http://data.europa.eu/esco/skill/def007fa-5fed-4a5f-91a2-b0d7e3db1be1, http://data.europa.eu/esco/skill/e8b89eb6-51e8-4c3a-babb-88b2e110376b, http://data.europa.eu/esco/skill/eb0e5615-1575-4a86-a1a2-7d39595033c5, http://data.europa.eu/esco/skill/fafe0b9d-dbd9-46bd-b770-26299539ce66, http://data.europa.eu/esco/skill/ffddfc7c-a9dd-449f-9e96-882dc447c8b6, http://data.europa.eu/esco/skill/0a52bed5-fd29-45fb-aba6-e32bccfda1c1, http://data.europa.eu/esco/skill/11430d93-c835-48ed-8e70-285fa69c9ae6, http://data.europa.eu/esco/skill/2c28fc20-8a60-4311-8899-5ef8729c05b3, http://data.europa.eu/esco/skill/339ac029-066a-4985-9f9d-b3d7c8fea0bb, http://data.europa.eu/esco/skill/48b68726-0fd6-4e03-a5eb-82236516ee7a, http://data.europa.eu/esco/skill/5b9cde20-f1b9-4adc-bfb3-dbf70b14138d, http://data.europa.eu/esco/skill/6b643893-0a1f-4f6c-83a1-e7eef75849b9, http://data.europa.eu/esco/skill/6c08403c-a5bb-4868-b8c2-b7d039c0e511, http://data.europa.eu/esco/skill/7e796b51-49d7-4e73-95af-2e7323763f15, http://data.europa.eu/esco/skill/9e06bac6-6b91-48ca-8b7d-c1f48cdecd7c, http://data.europa.eu/esco/skill/c32ad607-0c4d-4e34-b73f-668298f7bf13, http://data.europa.eu/esco/skill/cb5cccc9-abe4-4b11-abe6-d27e5cd85fb1, http://data.europa.eu/esco/skill/d3286405-49f8-4e8a-8046-a4376b4e7963, http://data.europa.eu/esco/skill/dc72ad0a-c5dc-4abd-bc0d-ca43e82162e1, http://data.europa.eu/esco/skill/dfff95c6-9758-4c04-a228-7eaa88dec6cd, http://data.europa.eu/esco/skill/f5dd06b8-5d17-4932-9d03-957d0c4f5051",2511,"google cloud, aws, agile, c#, system design, sql, mongodb, graphql, kubernetes, rest api, python, scrum, redis, docker, kafka, distributed systems, microservices, git, java, microsoft azure"
http://data.europa.eu/esco/occupation/e3229e40-f571-4b26-baca-29edc8fe313e,computer scientist,"scientific research methodology, data science, draft scientific or academic papers and technical documentation, use an application-specific interface, manage research data, conduct literature research, write research proposals, interact professionally in research and professional environments, define technology strategy, disseminate results to the scientific community, operate open source software, speak different languages, execute analytical mathematical calculations, apply statistical analysis techniques, evaluate research activities, demonstrate disciplinary expertise, conduct scholarly research, increase the impact of science on policy and society, manage findable accessible interoperable and reusable data, perform scientific research, manage intellectual property rights, apply for research funding, use back-up and recovery tools, conduct quantitative research, apply research ethics and scientific integrity principles in research activities, promote open innovation in research, conduct research interview, publish academic research, promote the transfer of knowledge, think abstractly, execute ICT user research activities, mentor individuals, apply reverse engineering, synthesise research publications, manage personal professional development, write scientific publications, develop professional network with researchers and scientists, integrate gender dimension in research, perform project management, manage open publications, synthesise information, conduct research across disciplines, conduct qualitative research, promote the participation of citizens in scientific and research activities, communicate with a non-scientific audience, computer simulation, Apache Tomcat, business intelligence, MDX, software frameworks, data mining, behavioural science, innovation processes, documentation types, XQuery, emergent technologies, image recognition, data engineering, SQL, scientific computing, SPARQL, information extraction, operational research, NoSQL, mathematical physics, information categorisation, resource description framework query language, JavaScript Framework, query languages, LDAP, digitization, unstructured data, LINQ, cognitive computing, computational biology, quantum computing, N1QL, create solutions to problems, use spreadsheets software, use presentation software, perform data mining, develop computer vision system, teach in academic or vocational contexts, use query languages, innovate in ICT, apply blended learning, implement anti-virus software, develop professional network, report analysis results, process data","essential, optional","knowledge, skill/competence","http://data.europa.eu/esco/skill/ed3f3dba-3a35-4ed5-b113-67f4d10ef4c8, http://data.europa.eu/esco/skill/edebd83d-35f6-4ed5-a940-6c203d178c01, http://data.europa.eu/esco/skill/00b9a3aa-7070-4bb5-8020-f228a97cf42f, http://data.europa.eu/esco/skill/04fe962b-4017-4eb7-9139-7d69b6922bc9, http://data.europa.eu/esco/skill/08b04e53-ed25-41a2-9f90-0b9cd939ba3d, http://data.europa.eu/esco/skill/0d282d6e-8cb9-4339-8e7d-cfafed96b5ed, http://data.europa.eu/esco/skill/0ee7b0d6-db98-4785-9948-f2ef415d155a, http://data.europa.eu/esco/skill/20a8fe89-d4eb-4698-8521-8881c13377e0, http://data.europa.eu/esco/skill/248894d1-42dc-474f-af6e-2da52ac0c679, http://data.europa.eu/esco/skill/2b1e2927-3542-48da-9063-02925e7562c1, http://data.europa.eu/esco/skill/2b34764d-637c-48f5-aa70-31e15c965db6, http://data.europa.eu/esco/skill/2de4572a-4724-4f76-afc2-72a568a264ac, http://data.europa.eu/esco/skill/31c69100-b612-4a61-8db5-fd314318854c, http://data.europa.eu/esco/skill/382c11ed-20d5-4ae7-b60e-15fec527fa6c, http://data.europa.eu/esco/skill/39f67488-cfd3-4370-8d7e-da98163102d9, http://data.europa.eu/esco/skill/4134622c-c3fb-4a41-beb6-6d58ba5107db, http://data.europa.eu/esco/skill/485cdafb-3c7f-4104-ab1c-773e6131a39a, http://data.europa.eu/esco/skill/4d39b27a-b34f-4c89-8d46-df844d42f728, http://data.europa.eu/esco/skill/4f5c1208-62fd-4e5a-a51e-306c06947e11, http://data.europa.eu/esco/skill/4fabca9a-7435-4f33-b1da-3cdb00340fdc, http://data.europa.eu/esco/skill/518dc04d-092d-4fa1-bd82-88b7a9278ef7, http://data.europa.eu/esco/skill/5f0082ab-2131-49b5-94d6-a1821daf57d6, http://data.europa.eu/esco/skill/82de2df7-0d6c-42b1-94ac-b3e9a029e917, http://data.europa.eu/esco/skill/8316979b-df5a-4dc7-98ef-61ec6a10df84, http://data.europa.eu/esco/skill/833289fa-3646-4010-9d9e-93ba8c9ef2d8, http://data.europa.eu/esco/skill/872a1632-f1db-4feb-bb27-0a6a359b7591, http://data.europa.eu/esco/skill/896563fc-6255-4419-89c2-ffed30159ad6, http://data.europa.eu/esco/skill/979cf728-896f-4f2c-8fa8-2698ca0d4930, http://data.europa.eu/esco/skill/988f4ac3-a37c-4b0a-a40f-4e0e56b5919e, http://data.europa.eu/esco/skill/9a58cd26-58eb-4a1c-b1b6-64037fe9cfa1, http://data.europa.eu/esco/skill/a4c2aa71-086f-4a46-b481-2619673c9dfe, http://data.europa.eu/esco/skill/a584a638-a2c0-4b3c-bdf3-a64f87225be9, http://data.europa.eu/esco/skill/a7a14be2-78b5-4b4a-ba77-2658285e2756, http://data.europa.eu/esco/skill/a8b3957f-08b4-4a76-927d-0b2e3d0dbd39, http://data.europa.eu/esco/skill/a8d24a95-47b3-4f88-92e7-06600bcd3612, http://data.europa.eu/esco/skill/c3c2420c-ce9a-4371-8eed-1db479c3a562, http://data.europa.eu/esco/skill/cc61f9e5-d4fc-470e-8606-1ce865ff8386, http://data.europa.eu/esco/skill/cd50d616-1f8b-481e-983f-68d2674ff82d, http://data.europa.eu/esco/skill/cd5efa8c-e44d-4cbc-91c6-796018dbed68, http://data.europa.eu/esco/skill/da930e2f-6047-4616-a598-bba8ecef3039, http://data.europa.eu/esco/skill/f715be1d-5fc4-49d3-82a5-0b8090d12849, http://data.europa.eu/esco/skill/f7b071bf-4882-4cfc-ae0a-7e0e0ab94c61, http://data.europa.eu/esco/skill/fa465db3-56e8-4b5d-a781-e2a313a4ed2d, http://data.europa.eu/esco/skill/fa642fc3-5cc5-41cf-8926-6617a8b976a7, http://data.europa.eu/esco/skill/ff64e9fc-36dd-4035-872a-83aa41dc1ad9, http://data.europa.eu/esco/skill/0823ccef-813f-4f22-afef-ac0d68615e8f, http://data.europa.eu/esco/skill/0fb753a1-2ef2-4429-84d2-ecb2b24daf7a, http://data.europa.eu/esco/skill/143769cb-b61e-47d8-a61e-eedfbec1016c, http://data.europa.eu/esco/skill/1b7c716e-af95-4cda-a42f-6479c8b139f5, http://data.europa.eu/esco/skill/24c200e5-be20-4370-a137-ab53797f3a17, http://data.europa.eu/esco/skill/25f0ea33-b4a2-4f31-b7b4-7d20e827b180, http://data.europa.eu/esco/skill/269b8734-fa1d-4c6f-a843-523fa3bbae6e, http://data.europa.eu/esco/skill/2fb8480e-de3c-462b-b169-e8bbb344da68, http://data.europa.eu/esco/skill/327d15c8-29ff-4ad4-a4fe-6536d777a45f, http://data.europa.eu/esco/skill/3f4dab51-572b-4e2c-85ef-3b4c3f7094e1, http://data.europa.eu/esco/skill/42cb7669-c371-4903-9c0b-13db67b2e4bb, http://data.europa.eu/esco/skill/45f1ae17-c20d-40fc-9307-7d33b6ca9213, http://data.europa.eu/esco/skill/48db96bf-3314-45c6-bad8-fdb6e20e5639, http://data.europa.eu/esco/skill/598de5b0-5b58-4ea7-8058-a4bc4d18c742, http://data.europa.eu/esco/skill/5b26f08b-88bc-45f0-b901-530d7786466b, http://data.europa.eu/esco/skill/5da8018b-ae85-4cde-ad93-0394369018f3, http://data.europa.eu/esco/skill/696e3b5b-8b61-45af-ae4c-3ab700f197ec, http://data.europa.eu/esco/skill/726abd5a-d23c-44b9-abb0-f22bbe95f1d3, http://data.europa.eu/esco/skill/76ef6ed3-1658-4a1a-9593-204d799c6d0c, http://data.europa.eu/esco/skill/7e5a7bec-0e19-4a35-b27b-1c4a6d9c4de0, http://data.europa.eu/esco/skill/93aaf65c-5aad-4e6f-a7ba-ce9bf7c0e6e6, http://data.europa.eu/esco/skill/99207709-d076-4cce-ba38-e90d3bb28806, http://data.europa.eu/esco/skill/9b9de2a4-d8af-4a7b-933a-a8334ae60067, http://data.europa.eu/esco/skill/9cf681c7-89ec-470c-b651-7fe03786f586, http://data.europa.eu/esco/skill/a57a54b6-2f2e-43e4-9621-b52f4a63cb08, http://data.europa.eu/esco/skill/aa0d8201-5a8e-417f-81f4-c04601139582, http://data.europa.eu/esco/skill/c5e8abde-d2ba-4e8e-a65e-720b71180666, http://data.europa.eu/esco/skill/c7d24594-0c11-4b27-9039-fe0bb903da8e, http://data.europa.eu/esco/skill/ca71c597-51c2-4ead-a7b0-b108bce89caf, http://data.europa.eu/esco/skill/e464363b-8346-421d-9035-52118b76d8c8, http://data.europa.eu/esco/skill/e79a3803-dd53-46b0-906b-13e6d46ef687, http://data.europa.eu/esco/skill/f597f772-24d3-4cec-813c-cf5a7027c794, http://data.europa.eu/esco/skill/03b9b491-fc9b-4868-914a-bf7cd47b5041, http://data.europa.eu/esco/skill/1973c966-f236-40c9-b2d4-5d71a89019be, http://data.europa.eu/esco/skill/234aeb8d-56c3-4531-9193-1c5e6a8d16cb, http://data.europa.eu/esco/skill/4216e465-7baa-4884-a241-54b197bb9278, http://data.europa.eu/esco/skill/4754d9fe-dc3a-4f8f-8ea6-5dbcea3a21ca, http://data.europa.eu/esco/skill/4cd85845-f31c-4306-994d-e12d45114d83, http://data.europa.eu/esco/skill/75f839c2-fd9a-4ad3-8921-6e734608568d, http://data.europa.eu/esco/skill/8327754d-3990-4056-b07e-4faa49cfcd26, http://data.europa.eu/esco/skill/b363bb5f-2c79-40af-94da-33e06f9dee9f, http://data.europa.eu/esco/skill/bb2b4485-2bad-402f-8517-44bf7d9afff4, http://data.europa.eu/esco/skill/bf5d77ad-e18c-48d8-83f0-bc79c011c74a, http://data.europa.eu/esco/skill/c544a9f3-5945-4b54-afed-de0697852817, http://data.europa.eu/esco/skill/f2d57f41-43b4-4f5b-8100-3df5c21eda50",2511,"python, java, c, c++, c#, javascript, typescript, go, rust, kotlin, php, ruby, scala, bash, json, rest api, sql, docker, kubernetes, linux, git, github, unit testing, integration testing, test automation, junit, pytest, object oriented programming, design patterns, microservices, distributed systems, system design, agile, scrum, kanban"
